Topic summary,Associated Links,Week Number,wc_date,Date,Sender,Email ID,link,L,LD,I,whois,source,Rank,Category,Year,Week Range,date_updated
How did you like this issue of Data Elixir? - provide feedback on the current issue of Data Elixir.,"['https://dataelixir.typeform.com/to/Dqw0wpS2', 'https://dataelixir.typeform.com/to/PJiwTd7v', 'https://dataelixir.typeform.com/to/LVkyZfXJ']",31,31/07/2023,08/02/2023,Data Elixir <lon@dataelixir.com>,189b236a148c73fb,"['https://dataelixir.typeform.com/to/Dqw0wpS2', 'https://dataelixir.typeform.com/to/PJiwTd7v', 'https://dataelixir.typeform.com/to/LVkyZfXJ']",337.0,,,,,,[],,,09/08/2023
Telling Stories with Data - a new book on data science that focuses on telling stories with data via case studies and statistical models.,['https://tellingstorieswithdata.com/?utm_campaign=Data_Elixir&utm_source=Data_Elixir_446'],31,31/07/2023,08/02/2023,Data Elixir <lon@dataelixir.com>,189b236a148c73fb,['https://tellingstorieswithdata.com/?utm_campaign=Data_Elixir&utm_source=Data_Elixir_446'],179.0,308.0,128.0,,,3030000.0,['AI Marketing tools'],,,09/08/2023
Announcing Jupyter Notebook 7 - the most significant release of Jupyter Notebook with new features like real-time collaboration and dark mode.,['https://blog.jupyter.org/announcing-jupyter-notebook-7-8d6d66126dcf?utm_campaign=Data_Elixir&utm_source=Data_Elixir_446'],31,31/07/2023,08/02/2023,Data Elixir <lon@dataelixir.com>,189b236a148c73fb,['https://blog.jupyter.org/announcing-jupyter-notebook-7-8d6d66126dcf?utm_campaign=Data_Elixir&utm_source=Data_Elixir_446'],21200.0,92400.0,2170.0,,,15000.0,['New Tech and AI tools'],,,09/08/2023
tinyvector - a nearest-neighbor embedding database built with SQLite and Pytorch for fast querying and scalability.,['https://github.com/0hq/tinyvector?utm_campaign=Data_Elixir&utm_source=Data_Elixir_446#readme'],31,31/07/2023,08/02/2023,Data Elixir <lon@dataelixir.com>,189b236a148c73fb,['https://github.com/0hq/tinyvector?utm_campaign=Data_Elixir&utm_source=Data_Elixir_446#readme'],4480.0,8920000000.0,115000.0,,,286.0,['New Tech and AI tools'],,,09/08/2023
How to Check 2 SQL Tables are the Same - a post challenging readers to write a query that checks if two SQL tables are the same.,"['https://github.com/remysucre/blog/blob/main/posts/sql-eq.md?utm_campaign=Data_Elixir&utm_source=Data_Elixir_446', 'https://news.ycombinator.com/item?id=36889656&utm_campaign=Data_Elixir&utm_source=Data_Elixir_446']",31,31/07/2023,08/02/2023,Data Elixir <lon@dataelixir.com>,189b236a148c73fb,"['https://github.com/remysucre/blog/blob/main/posts/sql-eq.md?utm_campaign=Data_Elixir&utm_source=Data_Elixir_446', 'https://news.ycombinator.com/item?id=36889656&utm_campaign=Data_Elixir&utm_source=Data_Elixir_446']",540000.0,,,,,,['AI in business'],,,09/08/2023
Treemaps are awesome! - a blog post highlighting the usefulness of treemaps in visualizing and exploring data.,['https://blog.phronemophobic.com/treemaps-are-awesome.html?utm_campaign=Data_Elixir&utm_source=Data_Elixir_446'],31,31/07/2023,08/02/2023,Data Elixir <lon@dataelixir.com>,189b236a148c73fb,['https://blog.phronemophobic.com/treemaps-are-awesome.html?utm_campaign=Data_Elixir&utm_source=Data_Elixir_446'],1490.0,3220.0,23.0,,,39900000.0,['AI real-world applications'],,,09/08/2023
Complete customer profiles in your data warehouse - a sponsored link describing RudderStack Profiles and its ability to create complete customer profiles.,['https://www.rudderstack.com/product/profiles/?utm_source=data_elixir&utm_medium=newsletter&utm_campaign=CMPGN_173_P&utm_content=None&utm_term=%7Bkeyword%7D&utm_referrer=None&raid=ff47ca3fcd9b466cb67ba56fe54e2d34'],31,31/07/2023,08/02/2023,Data Elixir <lon@dataelixir.com>,189b236a148c73fb,['https://www.rudderstack.com/product/profiles/?utm_source=data_elixir&utm_medium=newsletter&utm_campaign=CMPGN_173_P&utm_content=None&utm_term=%7Bkeyword%7D&utm_referrer=None&raid=ff47ca3fcd9b466cb67ba56fe54e2d34'],4.0,,,,,,['AI Marketing tools'],,,09/08/2023
Design Patterns for LLM Systems & Products - a post exploring practical patterns for integrating large language models into systems and products.,['https://eugeneyan.com/writing/llm-patterns/?utm_campaign=Data_Elixir&utm_source=Data_Elixir_446'],31,31/07/2023,08/02/2023,Data Elixir <lon@dataelixir.com>,189b236a148c73fb,['https://eugeneyan.com/writing/llm-patterns/?utm_campaign=Data_Elixir&utm_source=Data_Elixir_446'],3630.0,154000.0,226.0,,,1880000.0,['AI real-world applications'],,,09/08/2023
"Ultimate practical guide to conjoint analysis with R - a practical guide for conducting conjoint analysis using R, brms, and marginaleffects.",['https://www.andrewheiss.com/blog/2023/07/25/conjoint-bayesian-frequentist-guide/?utm_campaign=Data_Elixir&utm_source=Data_Elixir_446'],31,31/07/2023,08/02/2023,Data Elixir <lon@dataelixir.com>,189b236a148c73fb,['https://www.andrewheiss.com/blog/2023/07/25/conjoint-bayesian-frequentist-guide/?utm_campaign=Data_Elixir&utm_source=Data_Elixir_446'],,,,,,,['AI real-world applications'],,,09/08/2023
Shiny for Python - an episode discussing the introduction of the Shiny framework to the Python community.,['https://talkpython.fm/episodes/show/424/shiny-for-python?utm_campaign=Data_Elixir&utm_source=Data_Elixir_446'],31,31/07/2023,08/02/2023,Data Elixir <lon@dataelixir.com>,189b236a148c73fb,['https://talkpython.fm/episodes/show/424/shiny-for-python?utm_campaign=Data_Elixir&utm_source=Data_Elixir_446'],2630.0,1120000.0,1760.0,,,1110000.0,['AI real-world applications'],,,09/08/2023
The Many Ways that Digital Minds Can Know - an insightful post discussing the contradictions of LLMs.,['https://moultano.wordpress.com/2023/06/28/the-many-ways-that-digital-minds-can-know/?utm_campaign=Data_Elixir&utm_source=Data_Elixir_446'],31,31/07/2023,08/02/2023,Data Elixir <lon@dataelixir.com>,189b236a148c73fb,['https://moultano.wordpress.com/2023/06/28/the-many-ways-that-digital-minds-can-know/?utm_campaign=Data_Elixir&utm_source=Data_Elixir_446'],1610.0,4260.0,60.0,,,18200000.0,['AI news'],,,09/08/2023
Data Elixir contact information - reach out to Data Elixir for any questions or suggestions.,['https://www.linkedin.com/in/lonriesberg/'],31,31/07/2023,08/02/2023,Data Elixir <lon@dataelixir.com>,189b236a148c73fb,['https://www.linkedin.com/in/lonriesberg/'],0.0,13800000000.0,246000.0,,,12.0,[],,,09/08/2023
"Reproducible data science with Nix - a multi-part series exploring Nix, a package manager for ensuring reproducibility in data science projects.","['https://www.brodrigues.co/blog/2023-07-13-nix_for_r_part1/?utm_campaign=Data_Elixir&utm_source=Data_Elixir_446', 'https://www.brodrigues.co/blog/2023-07-19-nix_for_r_part2/?utm_campaign=Data_Elixir&utm_source=Data_Elixir_446', 'https://www.brodrigues.co/blog/2023-07-30-nix_for_r_part3//?utm_campaign=Data_Elixir&utm_source=Data_Elixir_446']",31,31/07/2023,08/02/2023,Data Elixir <lon@dataelixir.com>,189b236a148c73fb,"['https://www.brodrigues.co/blog/2023-07-13-nix_for_r_part1/?utm_campaign=Data_Elixir&utm_source=Data_Elixir_446', 'https://www.brodrigues.co/blog/2023-07-19-nix_for_r_part2/?utm_campaign=Data_Elixir&utm_source=Data_Elixir_446', 'https://www.brodrigues.co/blog/2023-07-30-nix_for_r_part3//?utm_campaign=Data_Elixir&utm_source=Data_Elixir_446']",17.0,,,,,,['New Tech and AI tools'],,,09/08/2023
Unsubscribe - unsubscribe from Data Elixir newsletter.,['https://news.dataelixir.com/t/t-u-zhriydl-jjkjlkhkm-d/'],31,31/07/2023,08/02/2023,Data Elixir <lon@dataelixir.com>,189b236a148c73fb,['https://news.dataelixir.com/t/t-u-zhriydl-jjkjlkhkm-d/'],,,,,,,[],,,09/08/2023
"Subscribe to the free AI Simple newsletter to get new tactics, resources, and prompt guides for driving business growth with AI. [Subscribe Here](https://aisimple.com/newsletter/?utm_source=WisdomMedia&utm_medium=newsletter&utm_campaign=TheEarlyCheckout)",['https://aisimple.com/newsletter/?utm_source=WisdomMedia&utm_medium=newsletter&utm_campaign=TheEarlyCheckout'],32,07/08/2023,08/08/2023,neonpulse <neonpulse@mail.beehiiv.com>,189d53ef05817872,['https://aisimple.com/newsletter/?utm_source=WisdomMedia&utm_medium=newsletter&utm_campaign=TheEarlyCheckout'],,,,,,,['AI Marketing tools'],,,10/08/2023
"Check out these cool AI tools: Klones, which creates your double with AI, and DashAI, which provides instant access to ChatGPT on any webpage. [Klones](https://klones.io/?utm_source=www.bigbraindaily.com&utm_medium=newsletter&utm_campaign=ai-dating-is-on-the-rise), [DashAI](https://www.dashai.xyz/?utm_source=www.bigbraindaily.com&utm_medium=newsletter&utm_campaign=ai-dating-is-on-the-rise)","['https://klones.io/?utm_source=www.bigbraindaily.com&utm_medium=newsletter&utm_campaign=ai-dating-is-on-the-rise', 'https://www.dashai.xyz/?utm_source=www.bigbraindaily.com&utm_medium=newsletter&utm_campaign=ai-dating-is-on-the-rise']",32,07/08/2023,08/08/2023,neonpulse <neonpulse@mail.beehiiv.com>,189d53ef05817872,"['https://klones.io/?utm_source=www.bigbraindaily.com&utm_medium=newsletter&utm_campaign=ai-dating-is-on-the-rise', 'https://www.dashai.xyz/?utm_source=www.bigbraindaily.com&utm_medium=newsletter&utm_campaign=ai-dating-is-on-the-rise']",,9800.0,5.0,,,,['New Tech and AI tools'],,,10/08/2023
"Zupyak is an AI writer that can help with writing SEO content and generating ideas. It does the SEO research for you while you write, helping you rank faster without using agencies or freelancers. [30 day free trial](https://link.zupyak.com/neon-pulse)",['https://link.zupyak.com/neon-pulse'],32,07/08/2023,08/08/2023,neonpulse <neonpulse@mail.beehiiv.com>,189d53ef05817872,['https://link.zupyak.com/neon-pulse'],,6.0,227.0,,,,"['AI Marketing tools', 'Writing prompts for chatbot assistants']",,,10/08/2023
"A Japanese supermarket, Aruk Mitajiri, is using AI to enhance the in-store shopping experience. Fujitsu's advanced AI analyzes customers' behaviors in real-time and provides personalized recommendations. This technology aims to make customers more confident about their purchases and reduce the need for extensive human resources. [Read More](https://www.theregister.com/2023/08/04/generative_ai_japan_supermarket/)",['https://www.theregister.com/2023/08/04/generative_ai_japan_supermarket/'],32,07/08/2023,08/08/2023,neonpulse <neonpulse@mail.beehiiv.com>,189d53ef05817872,['https://www.theregister.com/2023/08/04/generative_ai_japan_supermarket/'],12700.0,32799999.0,655.0,,,20600.0,['AI in business'],,Aug 07 - Aug 13,11/08/2023
"7 New AI tools: Stori AI, Clay HQ, Modify, Taskade, Relume Library, Wondercraft, and Supertools","['https://storiai.com/', 'https://clay.earth/nexus', 'https://www.modyfi.com/', 'https://www.taskade.com/?via=therundownai', 'https://library.relume.io/site-builder', 'https://www.wondercraft.ai/?via=rowan', 'https://supertools.therundown.ai/']",32,07/08/2023,08/08/2023,The Rundown AI <therundownai@mail.beehiiv.com>,189d55dcff979ed5,"['https://storiai.com/', 'https://clay.earth/nexus', 'https://www.modyfi.com/', 'https://www.taskade.com/?via=therundownai', 'https://library.relume.io/site-builder', 'https://www.wondercraft.ai/?via=rowan', 'https://supertools.therundown.ai/']",,2830.0,307.0,,,459000.0,['New Tech and AI tools'],,,10/08/2023
Microsoft celebrates 6 months of Bing AI and adds several AI tools to its products,"['https://blogs.bing.com/search/august-2023/Celebrating-6-months-of-the-new-AI-powered-Bing', 'https://youtu.be/jztM6qCmBPw']",32,07/08/2023,08/08/2023,The Rundown AI <therundownai@mail.beehiiv.com>,189d55dcff979ed5,"['https://blogs.bing.com/search/august-2023/Celebrating-6-months-of-the-new-AI-powered-Bing', 'https://youtu.be/jztM6qCmBPw']",1.0,604000000.0,35.0,,,132000.0,"['AI real-world applications', 'AI news', 'AI Marketing tools']",,Aug 07 - Aug 13,11/08/2023
"OpenAI launches GPTBot, a web crawler that automatically scrapes data from the internet for improving future AI models",['https://platform.openai.com/docs/gptbot'],32,07/08/2023,08/08/2023,The Rundown AI <therundownai@mail.beehiiv.com>,189d55dcff979ed5,['https://platform.openai.com/docs/gptbot'],,8780000.0,230.0,,,129.0,"['AI real-world applications', 'AI news']",,,10/08/2023
OpenAI's new tool to scrape data. OpenAI introduces GPTbot for crawling public web data for AI training purposes.,['https://www.maginative.com/article/openai-unveils-gptbot-to-crawl-public-web-data-for-ai-training/'],32,07/08/2023,08/08/2023,Prompts Daily <aadit@mail.neatprompts.com>,189d56af37f8e63a,['https://www.maginative.com/article/openai-unveils-gptbot-to-crawl-public-web-data-for-ai-training/'],,4420.0,321.0,,,2130000.0,['New Tech and AI tools'],,Aug 07 - Aug 13,13/08/2023
Why Japan is creating its own ChatGPT rival. Japan is developing its version of GPT with Softbank Group. Learn more about this Japanese ChatGPT rival.,['https://citylife.capetown/uncategorized/softbank-group-to-develop-japanese-version-of-gpt/325773/'],32,07/08/2023,08/08/2023,Prompts Daily <aadit@mail.neatprompts.com>,189d56af37f8e63a,['https://citylife.capetown/uncategorized/softbank-group-to-develop-japanese-version-of-gpt/325773/'],,619000.0,,,,18100000.0,['AI real-world applications'],,Aug 07 - Aug 13,13/08/2023
why did I get this?,['https://kdnuggets.us12.list-manage.com/about?u=4f2891ebb155b23f120ece0bd&id=b2fa8716d2&e=7b6d08f5b4&c=ce662c57e2'],32,07/08/2023,08/08/2023,KDnuggets <editor1@kdnuggets.com>,189d5799df0ba8c3,['https://kdnuggets.us12.list-manage.com/about?u=4f2891ebb155b23f120ece0bd&id=b2fa8716d2&e=7b6d08f5b4&c=ce662c57e2'],,,,,,,['AI in business'],,Aug 07 - Aug 13,13/08/2023
update subscription preferences,['https://kdnuggets.us12.list-manage.com/profile?u=4f2891ebb155b23f120ece0bd&id=b2fa8716d2&e=7b6d08f5b4&c=ce662c57e2'],32,07/08/2023,08/08/2023,KDnuggets <editor1@kdnuggets.com>,189d5799df0ba8c3,['https://kdnuggets.us12.list-manage.com/profile?u=4f2891ebb155b23f120ece0bd&id=b2fa8716d2&e=7b6d08f5b4&c=ce662c57e2'],,,,,,,['AI Marketing tools'],,Aug 07 - Aug 13,13/08/2023
unsubscribe from this list,['https://kdnuggets.us12.list-manage.com/unsubscribe?u=4f2891ebb155b23f120ece0bd&id=b2fa8716d2&e=7b6d08f5b4&c=ce662c57e2'],32,07/08/2023,08/08/2023,KDnuggets <editor1@kdnuggets.com>,189d5799df0ba8c3,['https://kdnuggets.us12.list-manage.com/unsubscribe?u=4f2891ebb155b23f120ece0bd&id=b2fa8716d2&e=7b6d08f5b4&c=ce662c57e2'],,,,,,,['No code AI use cases'],,Aug 07 - Aug 13,13/08/2023
Successful software architecture depends on how well your architecture characteristics are defined. Chapter 4 of the O’Reilly book Fundamentals of Software Architecture explains the architecture characteristics you need to consider—and their trade-offs.,"['https://ae.oreilly.com/Fundamentals_of_Software_Architecture_ch4?utm_medium=email&utm_source=kdnu&utm_campaign=2023+download&utm_content=email+fundamentals+of+software+architecture+20230808', 'https://ae.oreilly.com/Fundamentals_of_Software_Architecture_ch4?utm_medium=email&utm_source=kdnu&utm_campaign=2023+download&utm_content=email+fundamentals+of+software+architecture+20230808']",32,07/08/2023,08/08/2023,KDnuggets <editor1@kdnuggets.com>,189d5799df0ba8c3,"['https://ae.oreilly.com/Fundamentals_of_Software_Architecture_ch4?utm_medium=email&utm_source=kdnu&utm_campaign=2023+download&utm_content=email+fundamentals+of+software+architecture+20230808', 'https://ae.oreilly.com/Fundamentals_of_Software_Architecture_ch4?utm_medium=email&utm_source=kdnu&utm_campaign=2023+download&utm_content=email+fundamentals+of+software+architecture+20230808']",,25200000.0,4150.0,,,6880.0,"['AI real-world applications', 'New Tech and AI tools']",,Aug 07 - Aug 13,13/08/2023
Source: [Designer high-vis workwear](https://www.reddit.com/r/midjourney/comments/15hlxdw/asking_it_to_design_new_highvis_workwear_designed/?utm_source=share&utm_medium=ios_app&utm_name=ioscss&utm_content=1&utm_term=1),['https://www.reddit.com/r/midjourney/comments/15hlxdw/asking_it_to_design_new_highvis_workwear_designed/?utm_source=share&utm_medium=ios_app&utm_name=ioscss&utm_content=1&utm_term=1'],32,07/08/2023,08/08/2023,neonpulse <neonpulse@mail.beehiiv.com>,189d53ef05817872,['https://www.reddit.com/r/midjourney/comments/15hlxdw/asking_it_to_design_new_highvis_workwear_designed/?utm_source=share&utm_medium=ios_app&utm_name=ioscss&utm_content=1&utm_term=1'],,6530000000.0,696000.0,,,23.0,['AI news'],,,10/08/2023
"Bing Chat comes to more browsers now. Bing's AI expansion to top browsers can reshape our approach to search advertising and optimization. We can harness Bing's AI for quicker, smarter content creation for businesses. AI-enhanced shopping tools on Bing signal a commerce shift.","['https://www.cnet.com/tech/services-and-software/microsoft-brings-bing-ai-to-more-browsers/', 'https://www.bing.com/?/ai']",32,07/08/2023,08/08/2023,Prompts Daily <aadit@mail.neatprompts.com>,189d56af37f8e63a,"['https://www.cnet.com/tech/services-and-software/microsoft-brings-bing-ai-to-more-browsers/', 'https://www.bing.com/?/ai']",,1840000000.0,9180.0,,,261.0,"['AI real-world applications', 'AI Marketing tools']",,Aug 07 - Aug 13,13/08/2023
"Advertise your products in front of thousands of AI investors, developers, and enthusiasts. [Fill out the advertiser survey](https://docs.google.com/forms/d/e/1FAIpQLSc-UF-frqUxlWSCxYgjV0KMgciuq3zrLNJuiE8bBPT7r6vF5A/viewform) to learn more about advertising opportunities on neonpulse.",['https://docs.google.com/forms/d/e/1FAIpQLSc-UF-frqUxlWSCxYgjV0KMgciuq3zrLNJuiE8bBPT7r6vF5A/viewform'],32,07/08/2023,08/08/2023,neonpulse <neonpulse@mail.beehiiv.com>,189d53ef05817872,['https://docs.google.com/forms/d/e/1FAIpQLSc-UF-frqUxlWSCxYgjV0KMgciuq3zrLNJuiE8bBPT7r6vF5A/viewform'],,2950000000.0,5140.0,,,8.0,['AI Marketing tools'],,,10/08/2023
Boost your writing with AI using this trick to get thoughtful feedback and enhance your work.,['https://www.notion.so/Advanced-ChatGPT-Full-Guide-ac6aa68840bc427c83f4611dd2642f83'],32,07/08/2023,08/09/2023,The Rundown AI <therundownai@mail.beehiiv.com>,189da854ca25d510,['https://www.notion.so/Advanced-ChatGPT-Full-Guide-ac6aa68840bc427c83f4611dd2642f83'],0.0,,,,,,['Writing prompts for chatbot assistants'],,,10/08/2023
Narrative BI is an AI analytics platform that provides insights on marketing and advertising data.,['https://www.narrative.bi/?utm_source=therundown&utm_medium=newsletter&utm_campaign=nbiailaunch'],32,07/08/2023,08/09/2023,The Rundown AI <therundownai@mail.beehiiv.com>,189da854ca25d510,['https://www.narrative.bi/?utm_source=therundown&utm_medium=newsletter&utm_campaign=nbiailaunch'],,,,,,,['AI Marketing tools'],,,10/08/2023
"Google and Universal Music Group are negotiating AI-generated music using artists' voices, lyrics, or sounds.",['https://www.forbes.com/sites/tylerroush/2023/08/08/google-and-universal-music-group-negotiating-ai-generated-music-tool-report-says/?sh=4b8b167f22e7'],32,07/08/2023,08/09/2023,The Rundown AI <therundownai@mail.beehiiv.com>,189da854ca25d510,['https://www.forbes.com/sites/tylerroush/2023/08/08/google-and-universal-music-group-negotiating-ai-generated-music-tool-report-says/?sh=4b8b167f22e7'],,,,,,,['AI in business'],,,10/08/2023
NVIDIA unveiled a new AI chip called GH200 Grace Hopper Superchip for massive AI models.,['https://www.cnbc.com/2023/08/08/nvidia-reveals-new-ai-chip-says-cost-of-running-large-language-models-will-drop-significantly-.html'],32,07/08/2023,08/09/2023,The Rundown AI <therundownai@mail.beehiiv.com>,189da854ca25d510,['https://www.cnbc.com/2023/08/08/nvidia-reveals-new-ai-chip-says-cost-of-running-large-language-models-will-drop-significantly-.html'],,268000000.0,2620.0,,,91.0,['AI real-world applications'],,,10/08/2023
"Learn more about KDnuggets, its privacy policy, and how to contact them.","['https://www.kdnuggets.com/about/index.html', 'https://www.kdnuggets.com/news/privacy-policy.html', 'https://www.kdnuggets.com/contact.html']",32,07/08/2023,08/09/2023,KDnuggets <editor1@kdnuggets.com>,189da9f2f5d2198a,"['https://www.kdnuggets.com/about/index.html', 'https://www.kdnuggets.com/news/privacy-policy.html', 'https://www.kdnuggets.com/contact.html']",9.0,1330000.0,328.0,,,52100.0,['AI news'],,,10/08/2023
"Discover data observability for improved data, code, infrastructure, and AI by Toward Data Science.",['https://towardsdatascience.com/pioneering-data-observability-data-code-infrastructure-ai-c22a26706866'],32,07/08/2023,08/09/2023,KDnuggets <editor1@kdnuggets.com>,189da9f2f5d2198a,['https://towardsdatascience.com/pioneering-data-observability-data-code-infrastructure-ai-c22a26706866'],1.0,32700000.0,2000.0,,,4090.0,['AI Marketing tools'],,,10/08/2023
Explore seven AI projects suitable for all levels by DataCamp.,['https://www.datacamp.com/blog/7-ai-projects-for-all-levels'],32,07/08/2023,08/09/2023,KDnuggets <editor1@kdnuggets.com>,189da9f2f5d2198a,['https://www.datacamp.com/blog/7-ai-projects-for-all-levels'],,3450000.0,872.0,,,9490.0,['No code AI use cases'],,,10/08/2023
"A new AI marketing tool called Nexus engine by Vibes is helping brands plan and execute effective mobile marketing campaigns. It suggests tailored messages, timing, and promotions for different customer groups.","['https://www.vibes.com/platform', 'https://venturebeat.com/ai/vibes-announces-new-ai-engine-for-mobile-marketing-campaigns/']",32,07/08/2023,08/09/2023,Prompts Daily <aadit@mail.neatprompts.com>,189da7b17301ab38,"['https://www.vibes.com/platform', 'https://venturebeat.com/ai/vibes-announces-new-ai-engine-for-mobile-marketing-campaigns/']",,31100000.0,1220.0,,,11500.0,['AI Marketing tools'],,,10/08/2023
Learn about Docker crash course for data scientists by Data Science Horizons.,['https://datasciencehorizons.com/docker-crash-course-data-scientists/'],32,07/08/2023,08/09/2023,KDnuggets <editor1@kdnuggets.com>,189da9f2f5d2198a,['https://datasciencehorizons.com/docker-crash-course-data-scientists/'],,146.0,136.0,,,10800000.0,['New Tech and AI tools'],,,10/08/2023
"Stay updated with the latest AI news, including generative AI in Jupyter and Stack Overflow, and ChatGPT updates.",['https://www.kdnuggets.com/2023/mm/this-week-ai-2023-08-07.html'],32,07/08/2023,08/09/2023,KDnuggets <editor1@kdnuggets.com>,189da9f2f5d2198a,['https://www.kdnuggets.com/2023/mm/this-week-ai-2023-08-07.html'],,1330000.0,326.0,,,52100.0,['AI news'],,,10/08/2023
"Learn about CDC data replication techniques, tradeoffs, and insights.",['https://www.kdnuggets.com/2023/08/cdc-data-replication-techniques-tradeoffs-insights.html'],32,07/08/2023,08/09/2023,KDnuggets <editor1@kdnuggets.com>,189da9f2f5d2198a,['https://www.kdnuggets.com/2023/08/cdc-data-replication-techniques-tradeoffs-insights.html'],,1330000.0,327.0,,,52100.0,['AI in business'],,,10/08/2023
"Discover how zero-shot, one-shot, and few-shot learning are transforming machine learning.",['https://www.kdnuggets.com/2023/08/breaking-data-barrier-zeroshot-oneshot-fewshot-learning-transforming-machine-learning.html'],32,07/08/2023,08/09/2023,KDnuggets <editor1@kdnuggets.com>,189da9f2f5d2198a,['https://www.kdnuggets.com/2023/08/breaking-data-barrier-zeroshot-oneshot-fewshot-learning-transforming-machine-learning.html'],,1330000.0,328.0,,,52100.0,['AI in business'],,,10/08/2023
"Read the top posts of July 31 - August 6, featuring the new AI assistant that surpasses ChatGPT.",['https://www.kdnuggets.com/2023/08/top-posts-week-0731-0806.html'],32,07/08/2023,08/09/2023,KDnuggets <editor1@kdnuggets.com>,189da9f2f5d2198a,['https://www.kdnuggets.com/2023/08/top-posts-week-0731-0806.html'],,1330000.0,327.0,,,52100.0,['AI news'],,,10/08/2023
Google search now has a Grammar checker. It helps in finding and suggesting grammatical errors in search queries.,['https://in.mashable.com/tech/57785/google-search-now-has-a-grammar-checker'],32,07/08/2023,08/09/2023,Prompts Daily <aadit@mail.neatprompts.com>,189da7b17301ab38,['https://in.mashable.com/tech/57785/google-search-now-has-a-grammar-checker'],2.0,1150000.0,570.0,,,416.0,"['AI news', 'New Tech and AI tools']",,,10/08/2023
A video tutorial on everything you need to know about AI chatbots and how to build them.,['Youtube: How to Make Chatbots | Complete AI Chatbot Tutorial for Beginners'],32,07/08/2023,08/09/2023,Liam Ottley <morningsideai@mail.beehiiv.com>,189da6d243f95939,['Youtube: How to Make Chatbots | Complete AI Chatbot Tutorial for Beginners'],,,,,,,"['AI real-world applications', 'Writing prompts for chatbot assistants']",,,10/08/2023
"Introducing the AAA Accelerator program, providing 1-on-1 access to experts and tailored support.",['https://www.aaa-accelerator.co/'],32,07/08/2023,08/09/2023,Liam Ottley <morningsideai@mail.beehiiv.com>,189da6d243f95939,['https://www.aaa-accelerator.co/'],65500.0,0.0,3.0,,,,"['AI in business', 'AI Marketing tools']",,,10/08/2023
The effect of having AI as a personal trainer and its surprising effectiveness in promoting wellbeing and a healthy lifestyle.,"['https://www.nature.com/articles/s41746-023-00856-1', 'https://www.unisa.edu.au/media-centre/Releases/2023/out-with-the-life-coach-in-with-the-chatbot/', 'https://themessenger.com/tech/tech-companies-are-talking-a-big-game-on-ai-in-q2-investor-calls-analysis']",32,07/08/2023,08/09/2023,neonpulse <neonpulse@mail.beehiiv.com>,189da656a84921fe,"['https://www.nature.com/articles/s41746-023-00856-1', 'https://www.unisa.edu.au/media-centre/Releases/2023/out-with-the-life-coach-in-with-the-chatbot/', 'https://themessenger.com/tech/tech-companies-are-talking-a-big-game-on-ai-in-q2-investor-calls-analysis']",,745000.0,1720.0,,,75800.0,"['AI real-world applications', 'AI in business']",,,10/08/2023
