Topic summary,Associated Links,Week Number,wc_date,Date,Sender,Email ID,link,L,LD,I,whois,source,Rank,Category,Year,Week Range,date_updated
Patchstack is hiring an AI/ML Engineer. Flywire is hiring a Business Intelligence Analyst.,"['https://patchstack.bamboohr.com/careers/23', 'https://jobs.smartrecruiters.com/Flywire1/743999923350353-business-intelligence-analyst']",32,07/08/2023,08/10/2023,Prompts Daily <aadit@mail.neatprompts.com>,189dfa1c15f3ec69,"['https://patchstack.bamboohr.com/careers/23', 'https://jobs.smartrecruiters.com/Flywire1/743999923350353-business-intelligence-analyst']",,,,,,,['AI job opportunities'],,,10/08/2023
Find your path in Applied Data Science with Bay Path University's online Master's program. Enroll now for the upcoming schedules in October 2023 and March 2024.,['https://go.crm.baypath.edu/ADSKDnuggets'],32,07/08/2023,08/10/2023,KDnuggets <editor1@kdnuggets.com>,189dfc12d0822dae,['https://go.crm.baypath.edu/ADSKDnuggets'],,,,,,,"['Making money with AI', 'AI real-world applications', 'AI Marketing tools']",,,10/08/2023
Unsubscribe or update your subscription preferences for KDnuggets emails.,"['https://kdnuggets.us12.list-manage.com/unsubscribe?u=4f2891ebb155b23f120ece0bd&id=b2fa8716d2&e=7b6d08f5b4&c=6e73a7ee9a', 'https://kdnuggets.us12.list-manage.com/profile?u=4f2891ebb155b23f120ece0bd&id=b2fa8716d2&e=7b6d08f5b4&c=6e73a7ee9a']",32,07/08/2023,08/10/2023,KDnuggets <editor1@kdnuggets.com>,189dfc12d0822dae,"['https://kdnuggets.us12.list-manage.com/unsubscribe?u=4f2891ebb155b23f120ece0bd&id=b2fa8716d2&e=7b6d08f5b4&c=6e73a7ee9a', 'https://kdnuggets.us12.list-manage.com/profile?u=4f2891ebb155b23f120ece0bd&id=b2fa8716d2&e=7b6d08f5b4&c=6e73a7ee9a']",,,,,,,['AI news'],,,10/08/2023
Attend a free virtual webinar on August 16th about the impact of AI on the workforce.,['https://www.baypath.edu/events-calendar/details/ai-promises-to-impact-the-workforce-in-unexpected-ways/2023-08-16/'],32,07/08/2023,08/10/2023,KDnuggets <editor1@kdnuggets.com>,189dfc12d0822dae,['https://www.baypath.edu/events-calendar/details/ai-promises-to-impact-the-workforce-in-unexpected-ways/2023-08-16/'],,,,,,,['AI in business'],,,10/08/2023
"Bay Path University offers a flexible online Master's program in Applied Data Science with one and two-year schedules. The program prepares students for careers in data science, offering both a generalist track and a specialist track.","['https://go.crm.baypath.edu/ADSKDnuggets', 'https://www.baypath.edu/academics/graduate-programs/applied-data-science-ms/student-capstone-projects/', 'https://www.baypath.edu/events-calendar/details/ai-promises-to-impact-the-workforce-in-unexpected-ways/2023-08-16/']",32,07/08/2023,08/10/2023,KDnuggets <editor1@kdnuggets.com>,189dfc12d0822dae,"['https://go.crm.baypath.edu/ADSKDnuggets', 'https://www.baypath.edu/academics/graduate-programs/applied-data-science-ms/student-capstone-projects/', 'https://www.baypath.edu/events-calendar/details/ai-promises-to-impact-the-workforce-in-unexpected-ways/2023-08-16/']",0.0,,,,,,['AI in business'],,,11/08/2023
"Google introduces Project IDX, an AI-enabled development environment for building web and multiplatform apps.",['https://idx.dev/'],32,07/08/2023,08/10/2023,The Rundown AI <therundownai@mail.beehiiv.com>,189dfa77820560f1,['https://idx.dev/'],1740.0,,,,,,['New Tech and AI tools'],,,11/08/2023
AI is capable of building antibodies designed in a way unintuitive to the human process.,['https://www.wired.com/story/labgenius-antibody-factory-machine-learning/'],32,07/08/2023,08/10/2023,The Rundown AI <therundownai@mail.beehiiv.com>,189dfa77820560f1,['https://www.wired.com/story/labgenius-antibody-factory-machine-learning/'],,,,,,,['AI real-world applications'],,,10/08/2023
Big Brain Premium is offering a free edition of their premium newsletter for a limited time.,['50% off an annual subscription'],32,07/08/2023,08/10/2023,Big Brain <bigbrain@mail.beehiiv.com>,189df4009b309054,['50% off an annual subscription'],0.0,,,,,,"['Making money with AI', 'AI Marketing tools']",,,11/08/2023
Estimate causal effects using propensity score matching and learn data wrangling functions.,"['Unlocking Insights: Estimating Causal Effect Using Propensity Score Matching', 'Data Wrangling Functions']",32,07/08/2023,,Data Science Weekly Newsletter <datascienceweekly@substack.com>,189e287e8e280f83,"['Unlocking Insights: Estimating Causal Effect Using Propensity Score Matching', 'Data Wrangling Functions']",9.0,32799999.0,1220.0,,,4090.0,['No code AI use cases'],2023.0,Aug 07 - Aug 13,11/08/2023
"Learn tips for implementing a paper, the importance of ML theory, and principles for planning an academic workshop.","['Llama from scratch (or how to implement a paper without crying)', ""Whats the point of learning ML theory if industry doesn't care (other than interviews)?"", 'Principles for Planning an Academic Workshop']",32,07/08/2023,,Data Science Weekly Newsletter <datascienceweekly@substack.com>,189e287e8e280f83,"['Llama from scratch (or how to implement a paper without crying)', ""Whats the point of learning ML theory if industry doesn't care (other than interviews)?"", 'Principles for Planning an Academic Workshop']",2.0,10700.0,640.0,,,237000.0,"['New Tech and AI tools', 'Writing prompts for chatbot assistants']",2023.0,Aug 07 - Aug 13,11/08/2023
Tiny models that flip from memorizing to generalizing have sparked interest in grokking and mechanistic interpretability.,['Do Machine Learning Models Memorize or Generalize?'],32,07/08/2023,,Data Science Weekly Newsletter <datascienceweekly@substack.com>,189e287e8e280f83,['Do Machine Learning Models Memorize or Generalize?'],0.0,17200.0,234.0,,,958000.0,['AI real-world applications'],2023.0,Aug 07 - Aug 13,11/08/2023
"AI and data practitioners' tasks can be automated by LLMs, but it is unlikely to replace human involvement.","['What coal and Jevons’ paradox tell us about AI and data', 'The Direct Approach']",32,07/08/2023,,Data Science Weekly Newsletter <datascienceweekly@substack.com>,189e287e8e280f83,"['What coal and Jevons’ paradox tell us about AI and data', 'The Direct Approach']",1.0,25700.0,1.0,,,25600.0,"['AI real-world applications', 'AI in business']",2023.0,Aug 07 - Aug 13,11/08/2023
Learn about controlling tail risk in online ski-rental and find books by vibe with Viberary.,"['Controlling Tail Risk in Online Ski-Rental', 'Viberary - Tired of bad genre-based book recommendations?']",32,07/08/2023,,Data Science Weekly Newsletter <datascienceweekly@substack.com>,189e287e8e280f83,"['Controlling Tail Risk in Online Ski-Rental', 'Viberary - Tired of bad genre-based book recommendations?']",358.0,402.0,,,,,"['AI real-world applications', 'AI news']",2023.0,Aug 07 - Aug 13,11/08/2023
"AE's elite team of experts offers swift development of MVPs, Digital Transformation Initiatives, and tailored AI/ML solutions.","['Hire AE’s World Class Tech Team', 'Schedule a Consultation Today']",32,07/08/2023,,Data Science Weekly Newsletter <datascienceweekly@substack.com>,189e287e8e280f83,"['Hire AE’s World Class Tech Team', 'Schedule a Consultation Today']",0.0,580000.0,402.0,,,1160.0,"['AI Marketing tools', 'AI in business']",2023.0,Aug 07 - Aug 13,11/08/2023
New Tech and AI tools: Text-to-Video Generative AI Models: The Definitive List. Explore the growing text-to-video AI space and find out about models like Imagen Video,['https://app.go.informatech1.com/e/er?utm_source=eloqua&utm_medium=email&utm_campaign=AI_News_AIBusiness_NL_08112023&sp_cid=2614&utm_content=AI_News_AIBusiness_NL_08112023&sp_rid=6685973&sp_aid=3584&sp_eh=d13f3695dddfadb2e0f4f66bb4aeaf76bacc407eba26956739a0ebafc905c6ad&s=381216&lid=11749&elqTrackId=180bba84d6f641d9bd72c2d226b27134&elq=2ce5840f04414a30997191df2c3745f3&elqaid=3584&elqat=1'],32,07/08/2023,,AI Business <AIBusiness@go.informatech1.com>,189e448ea5d31b4c,['https://app.go.informatech1.com/e/er?utm_source=eloqua&utm_medium=email&utm_campaign=AI_News_AIBusiness_NL_08112023&sp_cid=2614&utm_content=AI_News_AIBusiness_NL_08112023&sp_rid=6685973&sp_aid=3584&sp_eh=d13f3695dddfadb2e0f4f66bb4aeaf76bacc407eba26956739a0ebafc905c6ad&s=381216&lid=11749&elqTrackId=180bba84d6f641d9bd72c2d226b27134&elq=2ce5840f04414a30997191df2c3745f3&elqaid=3584&elqat=1'],26.0,10100.0,1620.0,,,3370000.0,"['New Tech and AI tools', 'AI Marketing tools']",2023.0,Aug 07 - Aug 13,11/08/2023
AI real-world applications: A Novel Surgery Taps AI to Let Quadriplegic Move and Feel Again. First-of-its-kind surgery that implanted microchips in the brain led to natural recovery even when the system is turned off,['https://app.go.informatech1.com/e/er?utm_source=eloqua&utm_medium=email&utm_campaign=AI_News_AIBusiness_NL_08112023&sp_cid=2614&utm_content=AI_News_AIBusiness_NL_08112023&sp_rid=6685973&sp_aid=3584&sp_eh=d13f3695dddfadb2e0f4f66bb4aeaf76bacc407eba26956739a0ebafc905c6ad&s=381216&lid=11748&elqTrackId=f42c5acf94a14c73b3403be7e993564e&elq=2ce5840f04414a30997191df2c3745f3&elqaid=3584&elqat=1'],32,07/08/2023,,AI Business <AIBusiness@go.informatech1.com>,189e448ea5d31b4c,['https://app.go.informatech1.com/e/er?utm_source=eloqua&utm_medium=email&utm_campaign=AI_News_AIBusiness_NL_08112023&sp_cid=2614&utm_content=AI_News_AIBusiness_NL_08112023&sp_rid=6685973&sp_aid=3584&sp_eh=d13f3695dddfadb2e0f4f66bb4aeaf76bacc407eba26956739a0ebafc905c6ad&s=381216&lid=11748&elqTrackId=f42c5acf94a14c73b3403be7e993564e&elq=2ce5840f04414a30997191df2c3745f3&elqaid=3584&elqat=1'],26.0,10100.0,1620.0,,,3370000.0,['AI real-world applications'],2023.0,Aug 07 - Aug 13,11/08/2023
AI Tool: VocalReplica- Clone any voice with just one YouTube video.,['https://vocalreplica.com/'],32,07/08/2023,11/08/2023,neonpulse <neonpulse@mail.beehiiv.com>,189e4b0588e7908a,['https://vocalreplica.com/'],4.0,4.0,2.0,,,,['AI Marketing tools'],2023.0,Aug 07 - Aug 13,11/08/2023
Advertisement Opportunities on neonpu.,['https://docs.google.com/forms/d/e/1FAIpQLSc-UF-frqUxlWSCxYgjV0KMgciuq3zrLNJuiE8bBPT7r6vF5A/viewform)4'],32,07/08/2023,11/08/2023,neonpulse <neonpulse@mail.beehiiv.com>,189e4b0588e7908a,['https://docs.google.com/forms/d/e/1FAIpQLSc-UF-frqUxlWSCxYgjV0KMgciuq3zrLNJuiE8bBPT7r6vF5A/viewform)4'],9.0,2980000000.0,4170.0,,,8.0,['AI Marketing tools'],2023.0,Aug 07 - Aug 13,11/08/2023
Caption: Source: Humanoid flamingo.,['https://www.reddit.com/r/midjourney/comments/15mjleo/so_uh_i_asked_mj_for_a_humanoid_flamingo_creature/?utm_source=share&utm_medium=ios_app&utm_name=ioscss&utm_content=1&utm_term=1'],32,07/08/2023,11/08/2023,neonpulse <neonpulse@mail.beehiiv.com>,189e4b0588e7908a,['https://www.reddit.com/r/midjourney/comments/15mjleo/so_uh_i_asked_mj_for_a_humanoid_flamingo_creature/?utm_source=share&utm_medium=ios_app&utm_name=ioscss&utm_content=1&utm_term=1'],7730.0,6560000000.0,2140000.0,,,23.0,[],2023.0,Aug 07 - Aug 13,11/08/2023
"Potential role of AI in sick and elderly care, new prototype shows potential.","['https://media.beehiiv.com/cdn-cgi/image/fit=scale-down,format=auto,onerror=redirect,quality=80/uploads/asset/file/c9e1ff4e-4580-484a-a3aa-1f4ea7e0a2e7/neonpulse_11.png']",32,07/08/2023,11/08/2023,neonpulse <neonpulse@mail.beehiiv.com>,189e4b0588e7908a,"['https://media.beehiiv.com/cdn-cgi/image/fit=scale-down,format=auto,onerror=redirect,quality=80/uploads/asset/file/c9e1ff4e-4580-484a-a3aa-1f4ea7e0a2e7/neonpulse_11.png']",,,,,,,"['AI real-world applications', 'AI news']",2023.0,Aug 07 - Aug 13,11/08/2023
"The ebook 'Maximizing Productivity with ChatGPT' explores foundational principles, strategies, techniques, and guidance for using ChatGPT effectively as an expert helper, translator, summarizer, and diagram creator.","['GPT4All', 'Maximizing Productivity with ChatGPT (https://machinelearningmastery.com/productivity-with-chatgpt/)']",32,07/08/2023,11/08/2023,KDnuggets <editor1@kdnuggets.com>,189e4b14d74440dc,"['GPT4All', 'Maximizing Productivity with ChatGPT (https://machinelearningmastery.com/productivity-with-chatgpt/)']",31.0,373000.0,3.0,,,15900.0,"['AI real-world applications', 'New Tech and AI tools', 'AI Marketing tools']",2023.0,Aug 07 - Aug 13,11/08/2023
The ebook emphasizes that mastering AI involves more than just coding and provides an avenue to explore and master AI usage beyond traditional approaches.,['Maximizing Productivity with ChatGPT (https://machinelearningmastery.com/productivity-with-chatgpt/)'],32,07/08/2023,11/08/2023,KDnuggets <editor1@kdnuggets.com>,189e4b14d74440dc,['Maximizing Productivity with ChatGPT (https://machinelearningmastery.com/productivity-with-chatgpt/)'],31.0,373000.0,4.0,,,15900.0,"['AI real-world applications', 'AI in business', 'No code AI use cases']",2023.0,Aug 07 - Aug 13,11/08/2023
AI Tool: STORI AI- Create branded content with AI.,['https://storiai.com/'],32,07/08/2023,11/08/2023,neonpulse <neonpulse@mail.beehiiv.com>,189e4b0588e7908a,['https://storiai.com/'],27.0,49.0,19.0,,,11500000.0,['AI Marketing tools'],2023.0,Aug 07 - Aug 13,11/08/2023
Machine Learning Mastery and KDnuggets have collaborated to create a new ebook called 'Maximizing Productivity with ChatGPT'. It focuses on understanding and leveraging ChatGPT in AI applications.,"['Machine Learning Mastery (https://machinelearningmastery.com/)', 'Maximizing Productivity with ChatGPT (https://machinelearningmastery.com/productivity-with-chatgpt/)']",32,07/08/2023,11/08/2023,KDnuggets <editor1@kdnuggets.com>,189e4b14d74440dc,"['Machine Learning Mastery (https://machinelearningmastery.com/)', 'Maximizing Productivity with ChatGPT (https://machinelearningmastery.com/productivity-with-chatgpt/)']",31.0,373000.0,4.0,,,15900.0,"['AI real-world applications', 'New Tech and AI tools']",2023.0,Aug 07 - Aug 13,11/08/2023
How To Become A Pro ChatGPT User and improve your ChatGPT skills.,['https://twitter.com/aaditsh/status/1689634821868535808?s=20'],32,07/08/2023,11/08/2023,Prompts Daily <aadit@mail.neatprompts.com>,189e4beaa7de0850,['https://twitter.com/aaditsh/status/1689634821868535808?s=20'],7.0,52100000000.0,,,,3.0,['Writing prompts for chatbot assistants'],2023.0,Aug 07 - Aug 13,11/08/2023
AI is making workers more money in various fields such as marketing and coding.,['https://www.businessinsider.com/ai-chatgpt-jobs-side-hustle-make-more-money-accessible-2023-8'],32,07/08/2023,11/08/2023,Big Brain <bigbrain@mail.beehiiv.com>,189e4b5425d0a32b,['https://www.businessinsider.com/ai-chatgpt-jobs-side-hustle-make-more-money-accessible-2023-8'],49.0,204000000.0,1940.0,,,131.0,"['Making money with AI', 'AI in business']",2023.0,Aug 07 - Aug 13,11/08/2023
Cube3 .ai emerges with $8.2M seed funding to focus on cryptocurrency security.,['https://www.coindesk.com/business/2023/08/09/web3-security-startup-cube3ai-emerges-from-stealth-with-82m-seed-funding/'],32,07/08/2023,11/08/2023,Prompts Daily <aadit@mail.neatprompts.com>,189e4beaa7de0850,['https://www.coindesk.com/business/2023/08/09/web3-security-startup-cube3ai-emerges-from-stealth-with-82m-seed-funding/'],347.0,32200000.0,,,,1240.0,"['AI in business', 'AI Marketing tools', 'Making money with AI']",2023.0,Aug 07 - Aug 13,11/08/2023
Microsoft’s New AI Outperformed GPT-4 And It’s FREE.,['https://analyticsindiamag.com/gorilla-out-performs-gpt-4-in-making-api-calls/'],32,07/08/2023,11/08/2023,Prompts Daily <aadit@mail.neatprompts.com>,189e4beaa7de0850,['https://analyticsindiamag.com/gorilla-out-performs-gpt-4-in-making-api-calls/'],10.0,3230000.0,2280.0,,,75500.0,"['AI news', 'AI Marketing tools']",2023.0,Aug 07 - Aug 13,11/08/2023
"Learn about Anthropic's improved version of its LLM, Claude Instant 1.2.",['https://techcrunch.com/2023/08/09/anthropic-launches-improved-version-of-its-entry-level-llm/'],32,07/08/2023,11/08/2023,Big Brain <bigbrain@mail.beehiiv.com>,189e4b5425d0a32b,['https://techcrunch.com/2023/08/09/anthropic-launches-improved-version-of-its-entry-level-llm/'],1780.0,125000000.0,,,,575.0,['AI Marketing tools'],2023.0,Aug 07 - Aug 13,11/08/2023
"Welcome, AI enthusiasts. It’s absolutely insane what’s already possible with cloned AI-generated avatars. Where will we be in the next 12 months?","['https://twitter.com/joshua_xu_/status/1689019874667024384?s=20', 'https://www.guidde.com/?utm_source=newsletter&utm_medium=email&utm_campaign=rundown', 'https://www.therundown.ai/subscribe', 'https://sponsor.therundown.ai/', 'https://supertools.therundown.ai/', 'https://www.therundown.ai/']",32,07/08/2023,11/08/2023,The Rundown AI <therundownai@mail.beehiiv.com>,189e4cfda73e7dac,"['https://twitter.com/joshua_xu_/status/1689019874667024384?s=20', 'https://www.guidde.com/?utm_source=newsletter&utm_medium=email&utm_campaign=rundown', 'https://www.therundown.ai/subscribe', 'https://sponsor.therundown.ai/', 'https://supertools.therundown.ai/', 'https://www.therundown.ai/']",722.0,40400.0,138.0,,,459000.0,"['AI real-world applications', 'AI news', 'Making money with AI', 'AI Marketing tools']",2023.0,Aug 07 - Aug 13,11/08/2023
Staff Software Engineer job opening at Coinbase (Remote).,['https://www.coinbase.com/careers/positions/5284142?gh_jid=5284142'],32,07/08/2023,11/08/2023,Prompts Daily <aadit@mail.neatprompts.com>,189e4beaa7de0850,['https://www.coinbase.com/careers/positions/5284142?gh_jid=5284142'],0.0,11300000.0,,,,1250.0,"['AI in business', 'AI Marketing tools', 'AI news']",2023.0,Aug 07 - Aug 13,11/08/2023
"Advanced Guide to AI, a free guide available for all Prompts Daily readers.",['https://aaditsh.notion.site/aaditsh/Advanced-Guide-to-ChatGPT-b8d5901b8bba44f580bb0c0835644567?utm_source=www.neatprompts.com&utm_medium=newsletter&utm_campaign=meta-s-new-ai-for-speech'],32,07/08/2023,11/08/2023,Prompts Daily <aadit@mail.neatprompts.com>,189e4beaa7de0850,['https://aaditsh.notion.site/aaditsh/Advanced-Guide-to-ChatGPT-b8d5901b8bba44f580bb0c0835644567?utm_source=www.neatprompts.com&utm_medium=newsletter&utm_campaign=meta-s-new-ai-for-speech'],0.0,29200000.0,233.0,,,3230.0,"['AI Marketing tools', 'AI real-world applications']",2023.0,Aug 07 - Aug 13,11/08/2023
Horizon3 .ai raised $40M in the latest funding round to develop its NodeZero Security Platform.,['https://www.scmagazine.com/brief/funding-round-lands-40m-for-horizon3-ai'],32,07/08/2023,11/08/2023,Prompts Daily <aadit@mail.neatprompts.com>,189e4beaa7de0850,['https://www.scmagazine.com/brief/funding-round-lands-40m-for-horizon3-ai'],2.0,3400000.0,,,,110000.0,"['Making money with AI', 'AI in business']",2023.0,Aug 07 - Aug 13,11/08/2023
"Senior Mindset Book unlocks the potential of senior engineers to get promoted, earn more, think like a business, and lead with confidence.",['https://seniormindset.com/?utm_medium=email&utm_campaign=promps_daily'],32,07/08/2023,11/08/2023,Prompts Daily <aadit@mail.neatprompts.com>,189e4beaa7de0850,['https://seniormindset.com/?utm_medium=email&utm_campaign=promps_daily'],293.0,312.0,,,,,['AI Marketing tools'],2023.0,Aug 07 - Aug 13,11/08/2023
Stability AI releases the most powerful AI called Japanese StableLM in Japan.,['https://www.maginative.com/article/stability-ai-releases-japanese-stablelm-the-most-capable-japanese-llm/'],32,07/08/2023,11/08/2023,Prompts Daily <aadit@mail.neatprompts.com>,189e4beaa7de0850,['https://www.maginative.com/article/stability-ai-releases-japanese-stablelm-the-most-capable-japanese-llm/'],16.0,4560.0,321.0,,,2130000.0,['AI real-world applications'],2023.0,Aug 07 - Aug 13,11/08/2023
"Anthropic launches improved version of its LLM, Claude Instant 1.2.",['https://techcrunch.com/2023/08/09/anthropic-launches-improved-version-of-its-entry-level-llm/'],32,07/08/2023,11/08/2023,Big Brain <bigbrain@mail.beehiiv.com>,189e4b5425d0a32b,['https://techcrunch.com/2023/08/09/anthropic-launches-improved-version-of-its-entry-level-llm/'],1780.0,125000000.0,,,,575.0,"['AI news', 'AI real-world applications']",2023.0,Aug 07 - Aug 13,11/08/2023
"U.S. Launches $20M Tech Challenge inviting hackers to use AI for cybersecurity, with the winning team receiving a $20M prize.",['https://www.cnbc.com/2023/08/09/biden-admin-launches-hacking-challenge-to-use-ai-for-cybersecurity.html?__source=iosappshare%7Ccom.apple.UIKit.activity.CopyToPasteboard'],32,07/08/2023,11/08/2023,Prompts Daily <aadit@mail.neatprompts.com>,189e4beaa7de0850,['https://www.cnbc.com/2023/08/09/biden-admin-launches-hacking-challenge-to-use-ai-for-cybersecurity.html?__source=iosappshare%7Ccom.apple.UIKit.activity.CopyToPasteboard'],,,,,,,"['AI in business', 'AI news']",2023.0,Aug 07 - Aug 13,11/08/2023
"HyperWrite just launched the browser Personal Assistant, an AI agent that can control your browser. Try it for free by downloading the Chrome extension.","['https://www.hyperwriteai.com/personal-assistant?utm_source=newsletter&utm_medium=email&utm_campaign=promptsdaily', 'https://chrome.google.com/webstore/detail/hyperwrite-ai-assistant/kljjoeapehcmaphfcjkmbhkinoaopdnd']",32,07/08/2023,11/08/2023,Prompts Daily <aadit@mail.neatprompts.com>,189e4beaa7de0850,"['https://www.hyperwriteai.com/personal-assistant?utm_source=newsletter&utm_medium=email&utm_campaign=promptsdaily', 'https://chrome.google.com/webstore/detail/hyperwrite-ai-assistant/kljjoeapehcmaphfcjkmbhkinoaopdnd']",24.0,191000000.0,,,,8.0,['New Tech and AI tools'],2023.0,Aug 07 - Aug 13,11/08/2023
The FEC is considering AI deepfake regulation for political ads in 2024.,"['https://apnews.com/article/fec-artificial-intelligence-deepfakes-election-2024-95399e640bd1e41182f6c631717cc826', 'https://www.fec.gov/', 'https://www.politico.com/news/2023/07/17/desantis-pac-ai-generated-trump-in-ad-00106695', 'https://www.citizen.org/']",32,07/08/2023,11/08/2023,Big Brain <bigbrain@mail.beehiiv.com>,189e4b5425d0a32b,"['https://apnews.com/article/fec-artificial-intelligence-deepfakes-election-2024-95399e640bd1e41182f6c631717cc826', 'https://www.fec.gov/', 'https://www.politico.com/news/2023/07/17/desantis-pac-ai-generated-trump-in-ad-00106695', 'https://www.citizen.org/']",30200.0,1070000.0,,,,91300.0,['AI Marketing tools'],2023.0,Aug 07 - Aug 13,11/08/2023
"The FEC is looking to regulate AI deepfakes in campaign ads, particularly in the 2024 political ads.","['https://apnews.com/article/fec-artificial-intelligence-deepfakes-election-2024-95399e640bd1e41182f6c631717cc826', 'https://www.fec.gov/', 'https://www.politico.com/news/2023/07/17/desantis-pac-ai-generated-trump-in-ad-00106695', 'https://www.citizen.org/']",32,07/08/2023,11/08/2023,Big Brain <bigbrain@mail.beehiiv.com>,189e4b5425d0a32b,"['https://apnews.com/article/fec-artificial-intelligence-deepfakes-election-2024-95399e640bd1e41182f6c631717cc826', 'https://www.fec.gov/', 'https://www.politico.com/news/2023/07/17/desantis-pac-ai-generated-trump-in-ad-00106695', 'https://www.citizen.org/']",30200.0,1070000.0,,,,91300.0,['AI news'],2023.0,Aug 07 - Aug 13,11/08/2023
Summary of AI real-world applications.,['www.example3.com'],32,07/08/2023,,Ryan Pollard <rypoll@gmail.com>,189e4f045a5d6fa8,['www.example3.com'],3220.0,4770.0,2070.0,,,19900000.0,['AI real-world applications'],2023.0,Aug 07 - Aug 13,2023-08-11
Summary of AI in business.,['www.example8.com'],32,07/08/2023,,Ryan Pollard <rypoll@gmail.com>,189e4f045a5d6fa8,['www.example8.com'],42.0,103.0,3.0,,,,['AI in business'],2023.0,Aug 07 - Aug 13,2023-08-11
Summary of writing prompts for chatbot assistants.,['www.example4.com'],32,07/08/2023,,Ryan Pollard <rypoll@gmail.com>,189e4f045a5d6fa8,['www.example4.com'],8700.0,307000.0,96.0,,,31500.0,['Writing prompts for chatbot assistants'],2023.0,Aug 07 - Aug 13,2023-08-11
Summary of no code AI use cases.,['www.example9.com'],32,07/08/2023,,Ryan Pollard <rypoll@gmail.com>,189e4f045a5d6fa8,['www.example9.com'],0.0,4240000.0,7520.0,,,43500.0,['No code AI use cases'],2023.0,Aug 07 - Aug 13,2023-08-11
Summary of AI news.,['www.example5.com'],32,07/08/2023,,Ryan Pollard <rypoll@gmail.com>,189e4f045a5d6fa8,['www.example5.com'],1.0,15200.0,515.0,,,587000.0,['AI news'],2023.0,Aug 07 - Aug 13,2023-08-11
Summary of AI marketing tools.,['www.example7.com'],32,07/08/2023,,Ryan Pollard <rypoll@gmail.com>,189e4f045a5d6fa8,['www.example7.com'],253.0,371.0,2.0,,,,['AI Marketing tools'],2023.0,Aug 07 - Aug 13,2023-08-11
Summary of making money with AI.,"['www.example1.com', 'www.example2.com']",32,07/08/2023,,Ryan Pollard <rypoll@gmail.com>,189e4f045a5d6fa8,"['www.example1.com', 'www.example2.com']",2370.0,30200.0,380.0,,,,['Making money with AI'],2023.0,Aug 07 - Aug 13,2023-08-11
Summary of new tech and AI tools.,['www.example6.com'],32,07/08/2023,,Ryan Pollard <rypoll@gmail.com>,189e4f045a5d6fa8,['www.example6.com'],4.0,2660000000.0,8740.0,,,111000.0,['New Tech and AI tools'],2023.0,Aug 07 - Aug 13,2023-08-11
Introduction to a new AI tool,['http://www.test.com'],32,07/08/2023,11/08/2023,Ryan Pollard <rypoll@gmail.com>,189e508db80b0c7b,['http://www.test.com'],2690000.0,4070000.0,143.0,,,23300.0,['New Tech and AI tools'],2023.0,Aug 07 - Aug 13,2023-08-11
Try this new AI tool called ChatGPT.,['chatgpt.com'],32,07/08/2023,08/11/2023,Ryan Pollard <rypoll@gmail.com>,189e516872ffee96,['chatgpt.com'],4410.0,9700.0,,,,421000.0,['New Tech and AI tools'],2023.0,Aug 07 - Aug 13,2023-08-11
Try the new AI tool at www.aitool.com,['www.aitool.com'],32,07/08/2023,11/08/2023,Ryan Pollard <rypoll@gmail.com>,189e5370780c49ee,['www.aitool.com'],154.0,7040.0,2230.0,,,469000.0,['New Tech and AI tools'],2023.0,Aug 07 - Aug 13,2023-08-11
Introduction to a new tool called aiiscool.com,['www.aiiscool.com'],32,07/08/2023,08/11/2023,Ryan Pollard <rypoll@gmail.com>,189e542a13da467e,['www.aiiscool.com'],21.0,9150000000.0,133000.0,,,287.0,['New Tech and AI tools'],2023.0,Aug 07 - Aug 13,2023-08-11
