Topic summary,Associated Links,Week Number,wc_date,Date,Sender,Email ID,link,L,LD,I,whois,source,Rank,Category,Year,Week Range,date_updated
"Tools & funding updates, job postings.","['https://www.wonderchat.io/?utm_source=newsletter&utm_medium=email&utm_campaign=promptsdaily', 'https://patentdrop.substack.com/?utm_source=PromptsDaily&utm_medium=Newsletter&utm_content=37', 'https://aaditsh.notion.site/aaditsh/Advanced-Guide-to-ChatGPT-b8d5901b8bba44f580bb0c0835644567?utm_source=www.neatprompts.com&utm_medium=newsletter&utm_campaign=meta-s-new-ai-for-speech', 'https://finance.yahoo.com/news/cyble-secures-24m-series-b-055200829.html', 'https://techcrunch.com/2023/08/03/coreweave-which-provides-cloud-infrastructure-for-ai-training-secures-2-3b-loan/', 'https://jobs.smartrecruiters.com/Visa/743999922698948-principal-data-scientist', 'https://recroom.com/careers?gh_jid=5703072003']",32,07/08/2023,07/08/2023,Prompts Daily <aadit@mail.neatprompts.com>,189d02559af9920c,"['https://www.wonderchat.io/?utm_source=newsletter&utm_medium=email&utm_campaign=promptsdaily', 'https://patentdrop.substack.com/?utm_source=PromptsDaily&utm_medium=Newsletter&utm_content=37', 'https://aaditsh.notion.site/aaditsh/Advanced-Guide-to-ChatGPT-b8d5901b8bba44f580bb0c0835644567?utm_source=www.neatprompts.com&utm_medium=newsletter&utm_campaign=meta-s-new-ai-for-speech', 'https://finance.yahoo.com/news/cyble-secures-24m-series-b-055200829.html', 'https://techcrunch.com/2023/08/03/coreweave-which-provides-cloud-infrastructure-for-ai-training-secures-2-3b-loan/', 'https://jobs.smartrecruiters.com/Visa/743999922698948-principal-data-scientist', 'https://recroom.com/careers?gh_jid=5703072003']",707.0,48400.0,536.0,,,21100.0,"['New Tech and AI tools', 'AI Marketing tools', 'AI news', 'AI in business']",2023.0,Aug 07 - Aug 13,12/08/2023
Use this awesome salary calculator specifically designed for people who work with data.,['https://jobs-in-data.com/salary-calculator?utm_campaign=Data_Elixir&utm_source=Data_Elixir_445'],30,24/07/2023,24/07/2023,Data Elixir <lon@dataelixir.com>,1898ec496527701f,['https://jobs-in-data.com/salary-calculator?utm_campaign=Data_Elixir&utm_source=Data_Elixir_445'],20.0,43.0,21.0,,,24500000.0,['Making money with AI'],2023.0,Jul 24 - Jul 30,12/08/2023
Add your name to Arc.net and be part of the credits. It's not too late to leave your mark.,"['http://arc.net/credits', 'https://browserco.typeform.com/thecredits']",30,24/07/2023,24/07/2023,The Browser Company <members@arc.net>,1898d714320dfd5a,"['http://arc.net/credits', 'https://browserco.typeform.com/thecredits']",233000.0,558000.0,6.0,,,18300.0,['AI in business'],2023.0,Jul 24 - Jul 30,12/08/2023
"Sam Altman, the founder of ChatGPT, expresses concerns about the use of AI in elections.",['https://futurism.com/the-byte/sam-altman-ai-elections'],32,07/08/2023,07/08/2023,Prompts Daily <aadit@mail.neatprompts.com>,189d02559af9920c,['https://futurism.com/the-byte/sam-altman-ai-elections'],79.0,23400000.0,196.0,,,9260.0,['AI news'],2023.0,Aug 07 - Aug 13,12/08/2023
"Meta's Most Powerful AI Is Free. Read about Meta's decision to make its most powerful AI, LLaMA2, free to use.","[""Meta's Most Powerful AI Is Free"", 'Meta and Microsoft joined forces', 'Qualcomm is planning to use this AI', 'You can also use this AI for your business']",29,17/07/2023,17/07/2023,,18973849912f5326,"[""Meta's Most Powerful AI Is Free"", 'Meta and Microsoft joined forces', 'Qualcomm is planning to use this AI', 'You can also use this AI for your business']",11900.0,44000000.0,2280.0,,,1540.0,,2023.0,Jul 17 - Jul 23,12/08/2023
"Cool AI Tools like Habitomic, Twon, and Moolight are making a difference.","['https://habitomic.com/', 'https://www.twon.app/', 'https://apps.apple.com/us/app/moolight-smart-diary/id1631169735?at=1000l6eA']",32,07/08/2023,07/08/2023,neonpulse <neonpulse@mail.beehiiv.com>,189d018c5496495e,"['https://habitomic.com/', 'https://www.twon.app/', 'https://apps.apple.com/us/app/moolight-smart-diary/id1631169735?at=1000l6eA']",0.0,2620000000.0,608000.0,,,14.0,['New Tech and AI tools'],2023.0,Aug 07 - Aug 13,12/08/2023
"US judge likely to dismiss artists’ lawsuit. U.S. District Judge Orrick is skeptical about a lawsuit from artists against generative AI firms. He said that he would likely dismiss these cases due to artists needing to make their case clearer. That being said, he would allow them to file another complaint.","['https://www.reuters.com/legal/litigation/us-judge-finds-flaws-artists-lawsuit-against-ai-companies-2023-07-19/', '(non paywall here)']",29,17/07/2023,17/07/2023,,189736651f2f87ac,"['https://www.reuters.com/legal/litigation/us-judge-finds-flaws-artists-lawsuit-against-ai-companies-2023-07-19/', '(non paywall here)']",160000.0,10700000.0,1090.0,,,18600.0,,2023.0,Jul 17 - Jul 23,12/08/2023
Cool AI Tools,"['Tavily', 'Cheerleader AI']",29,17/07/2023,17/07/2023,,1896a76c1c2fdc4c,"['Tavily', 'Cheerleader AI']",2200.0,2590.0,7.0,,,,,2023.0,Jul 17 - Jul 23,12/08/2023
Tractable snaps up $65M led by SoftBank for car and property damage appraisals using AI,['https://techcrunch.com/2023/07/18/tractable-snaps-up-65m-led-by-softbank-for-car-and-property-damage-appraisals-using-ai/'],29,17/07/2023,17/07/2023,,1896e4e68e598a45,['https://techcrunch.com/2023/07/18/tractable-snaps-up-65m-led-by-softbank-for-car-and-property-damage-appraisals-using-ai/'],1290.0,125000000.0,2170.0,,,575.0,,2023.0,Jul 17 - Jul 23,12/08/2023
"Learn about Cheat Sheets, Datasets, Education, Events, Jobs, Projects, Publications, and Webinars.","['https://www.kdnuggets.com/cheat-sheets/index.html', 'https://www.kdnuggets.com/datasets/index.html', 'https://www.kdnuggets.com/education/index.html', 'https://www.kdnuggets.com/meetings/index.html', 'https://www.kdnuggets.com/jobs/index.html', 'https://www.kdnuggets.com/projects/index.html', 'https://www.kdnuggets.com/publication/index.html', 'https://www.kdnuggets.com/webcasts/index.html']",29,17/07/2023,17/07/2023,,1896f5a53ea7542d,"['https://www.kdnuggets.com/cheat-sheets/index.html', 'https://www.kdnuggets.com/datasets/index.html', 'https://www.kdnuggets.com/education/index.html', 'https://www.kdnuggets.com/meetings/index.html', 'https://www.kdnuggets.com/jobs/index.html', 'https://www.kdnuggets.com/projects/index.html', 'https://www.kdnuggets.com/publication/index.html', 'https://www.kdnuggets.com/webcasts/index.html']",46.0,1340000.0,2100.0,,,52100.0,,2023.0,Jul 17 - Jul 23,12/08/2023
You can learn more about the workshop and register using the provided links.,['https://cZkpm04.na1.hubspotlinks.com/Ctc/RI+113/cZkpm04/VWWpwf10wk3DW29V7TX8QQ7VrW4Rs6st51f10bN7gG7_Q3pl37V1-WJV7CgCK2VgqHcL7jTMfSW6DSh5-7qZh74W7TJ5jX5tGx6zW6CLmgh2s670HW2RfT8524BvB4MdyjSfXNx68W6zsw194-rl6QW7r8Fl885M-_mW4kk6kH3sSgJfW5NvQMW3BLHnTW8SH05X5ngL0HN6zpJq-l-1rSW8CJWtK7VCZD3W58GD_-8tjnyXVn6hyG72tf4ZVPFrnv8j-lJ6W79T7rh7VQd-pW417fKf1qX3CZW5Z_j1D2mY2zHW7ZwqXt4bsTlFW3jtjbc398b2sW7t0dVb2pFPqpVB-PBC2J3bkyW1CRLbY562c9DW795rZL808TBjW7ZzfGd8xW7f03lRN1'],29,17/07/2023,17/07/2023,,189788d02589462f,['https://cZkpm04.na1.hubspotlinks.com/Ctc/RI+113/cZkpm04/VWWpwf10wk3DW29V7TX8QQ7VrW4Rs6st51f10bN7gG7_Q3pl37V1-WJV7CgCK2VgqHcL7jTMfSW6DSh5-7qZh74W7TJ5jX5tGx6zW6CLmgh2s670HW2RfT8524BvB4MdyjSfXNx68W6zsw194-rl6QW7r8Fl885M-_mW4kk6kH3sSgJfW5NvQMW3BLHnTW8SH05X5ngL0HN6zpJq-l-1rSW8CJWtK7VCZD3W58GD_-8tjnyXVn6hyG72tf4ZVPFrnv8j-lJ6W79T7rh7VQd-pW417fKf1qX3CZW5Z_j1D2mY2zHW7ZwqXt4bsTlFW3jtjbc398b2sW7t0dVb2pFPqpVB-PBC2J3bkyW1CRLbY562c9DW795rZL808TBjW7ZzfGd8xW7f03lRN1'],25100.0,756000.0,2390.0,,,48300.0,,2023.0,Jul 17 - Jul 23,12/08/2023
Find Your Breakthrough AI Business Idea. Watch a free video lesson on finding your breakthrough AI business idea.,"['Find Your Breakthrough AI Business Idea', 'Rob Howard built two AI products in 4 weeks', 'The AI Business Model Matrix', 'The AI Venture Mindset', 'The AI Marketing Cookbook']",29,17/07/2023,17/07/2023,,18973849912f5326,"['Find Your Breakthrough AI Business Idea', 'Rob Howard built two AI products in 4 weeks', 'The AI Business Model Matrix', 'The AI Venture Mindset', 'The AI Marketing Cookbook']",0.0,5000.0,637.0,,,2250000.0,,2023.0,Jul 17 - Jul 23,12/08/2023
"IBM, Hugging Face, and NASA are collaborating to develop geospatial AI that can tackle climate data challenges.","['https://www.marktechpost.com/2023/08/06/ibm-huggingface-and-nasa-open-sources-watsonx%E2%80%A4ai-foundation-model-nasas-first-openly-available-ai-foundation-model-and-the-largest-geospatial-model-on-huggingface/', 'https://www.ibm.com/us-en', 'https://huggingface.co/', 'https://www.nasa.gov/']",32,07/08/2023,07/08/2023,Big Brain <bigbrain@mail.beehiiv.com>,189d1e0edefbed6d,"['https://www.marktechpost.com/2023/08/06/ibm-huggingface-and-nasa-open-sources-watsonx%E2%80%A4ai-foundation-model-nasas-first-openly-available-ai-foundation-model-and-the-largest-geospatial-model-on-huggingface/', 'https://www.ibm.com/us-en', 'https://huggingface.co/', 'https://www.nasa.gov/']",2610000.0,179000000.0,179.0,,,213.0,"['AI real-world applications', 'New Tech and AI tools', 'AI in business']",2023.0,Aug 07 - Aug 13,12/08/2023
Cool AI Tools,"['Tavily', 'Cheerleader AI']",29,17/07/2023,17/07/2023,,1896e3f1ef27617c,"['Tavily', 'Cheerleader AI']",2200.0,2590.0,7.0,,,,,2023.0,Jul 17 - Jul 23,12/08/2023
Concerns about the potential harm caused by AI in humanoid robots like Valkyrie.,['AI forum in Geneva (https://news.yahoo.com/ai-robot-gave-side-eye-200703987.html)'],29,17/07/2023,17/07/2023,,18982d91be1d2d9f,['AI forum in Geneva (https://news.yahoo.com/ai-robot-gave-side-eye-200703987.html)'],3.0,612000000.0,196000.0,,,15.0,,2023.0,Jul 17 - Jul 23,12/08/2023
"Alibaba has open-sourced its LLM, Tongyi Qianwen, allowing third-party developers to create their own AI applications.","['Alibaba open-sources ChatGPT competitor AI', 'https://www.cnbc.com/2023/08/03/alibaba-launches-open-sourced-ai-model-in-challenge-to-meta.html?ref=futuretools.io']",32,07/08/2023,07/08/2023,The Rundown AI <therundownai@mail.beehiiv.com>,189d034f612b8d48,"['Alibaba open-sources ChatGPT competitor AI', 'https://www.cnbc.com/2023/08/03/alibaba-launches-open-sourced-ai-model-in-challenge-to-meta.html?ref=futuretools.io']",2.0,270000000.0,2760.0,,,91.0,['AI real-world applications'],2023.0,Aug 07 - Aug 13,12/08/2023
"Apple is working on a ChatGPT competitor. Bloomberg's Mark Gurman reports they've built a chatbot internally dubbed 'Apple GPT' and crafted their slick framework 'Ajax' on Google Cloud! Impressive moves, but the release plan's still under wraps.",['https://techcrunch.com/2023/07/19/apple-is-testing-chatgpt-like-ai-chatbot/'],29,17/07/2023,17/07/2023,,189736651f2f87ac,['https://techcrunch.com/2023/07/19/apple-is-testing-chatgpt-like-ai-chatbot/'],2060.0,125000000.0,2170.0,,,575.0,,2023.0,Jul 17 - Jul 23,12/08/2023
"Neonpulse offers advertising opportunities to reach thousands of AI investors, developers, and enthusiasts.",['https://docs.google.com/forms/d/e/1FAIpQLSc-UF-frqUxlWSCxYgjV0KMgciuq3zrLNJuiE8bBPT7r6vF5A/viewform'],32,07/08/2023,07/08/2023,neonpulse <neonpulse@mail.beehiiv.com>,189d018c5496495e,['https://docs.google.com/forms/d/e/1FAIpQLSc-UF-frqUxlWSCxYgjV0KMgciuq3zrLNJuiE8bBPT7r6vF5A/viewform'],9.0,3000000000.0,4310.0,,,8.0,['AI Marketing tools'],2023.0,Aug 07 - Aug 13,12/08/2023
You can register for the workshop today.,['https://cZkpm04.na1.hubspotlinks.com/Ctc/RI+113/cZkpm04/VWWpwf10wk3DW29V7TX8QQ7VrW4Rs6st51f10bN7gG7_Q3pl37V1-WJV7CgCK2VgqHcL7jTMfSW6DSh5-7qZh74W7TJ5jX5tGx6zW6CLmgh2s670HW2RfT8524BvB4MdyjSfXNx68W6zsw194-rl6QW7r8Fl885M-_mW4kk6kH3sSgJfW5NvQMW3BLHnTW8SH05X5ngL0HN6zpJq-l-1rSW8CJWtK7VCZD3W58GD_-8tjnyXVn6hyG72tf4ZVPFrnv8j-lJ6W79T7rh7VQd-pW417fKf1qX3CZW5Z_j1D2mY2zHW7ZwqXt4bsTlFW3jtjbc398b2sW7t0dVb2pFPqpVB-PBC2J3bkyW1CRLbY562c9DW795rZL808TBjW7ZzfGd8xW7f03lRN1'],29,17/07/2023,17/07/2023,,189788d02589462f,['https://cZkpm04.na1.hubspotlinks.com/Ctc/RI+113/cZkpm04/VWWpwf10wk3DW29V7TX8QQ7VrW4Rs6st51f10bN7gG7_Q3pl37V1-WJV7CgCK2VgqHcL7jTMfSW6DSh5-7qZh74W7TJ5jX5tGx6zW6CLmgh2s670HW2RfT8524BvB4MdyjSfXNx68W6zsw194-rl6QW7r8Fl885M-_mW4kk6kH3sSgJfW5NvQMW3BLHnTW8SH05X5ngL0HN6zpJq-l-1rSW8CJWtK7VCZD3W58GD_-8tjnyXVn6hyG72tf4ZVPFrnv8j-lJ6W79T7rh7VQd-pW417fKf1qX3CZW5Z_j1D2mY2zHW7ZwqXt4bsTlFW3jtjbc398b2sW7t0dVb2pFPqpVB-PBC2J3bkyW1CRLbY562c9DW795rZL808TBjW7ZzfGd8xW7f03lRN1'],25100.0,756000.0,1980.0,,,48300.0,,2023.0,Jul 17 - Jul 23,12/08/2023
Promotion of neonpulse newsletter and subscription link.,['Neonpulse subscription link (https://www.neonpulse.ai/subscribe)'],29,17/07/2023,17/07/2023,,18982d91be1d2d9f,['Neonpulse subscription link (https://www.neonpulse.ai/subscribe)'],133.0,139.0,22.0,,,4980000.0,,2023.0,Jul 17 - Jul 23,12/08/2023
"Sign Up, Advertise, Learn","['https://www.neatprompts.com/subscribe?utm_source=promptsdaily&utm_medium=email&utm_campaign=top', 'https://sponsor.neatprompts.com', 'https://neatprompts.carrd.co/']",30,24/07/2023,24/07/2023,,1898823bbe404ee0,"['https://www.neatprompts.com/subscribe?utm_source=promptsdaily&utm_medium=email&utm_campaign=top', 'https://sponsor.neatprompts.com', 'https://neatprompts.carrd.co/']",183.0,184.0,3.0,,,,,2023.0,Jul 24 - Jul 30,12/08/2023
Circleback uses AI to help you get more out of your meetings by creating notes and action items for you.,['https://circleback.ai/?ref=supertools.therundown.ai'],30,24/07/2023,24/07/2023,,189881bc7fff7897,['https://circleback.ai/?ref=supertools.therundown.ai'],373.0,424.0,63.0,,,3600000.0,,2023.0,Jul 24 - Jul 30,12/08/2023
An AI tool called Superhuman AI provides a fast email experience and helps users write perfectly crafted emails that sound like them.,['https://superhuman.com/?utm_source=promptsdaily&utm_medium=newsletter&utm_campaign=ai_newsletter_July2023'],30,24/07/2023,24/07/2023,Prompts Daily <aadit@mail.neatprompts.com>,1898c901304ffed2,['https://superhuman.com/?utm_source=promptsdaily&utm_medium=newsletter&utm_campaign=ai_newsletter_July2023'],73900.0,79200.0,764.0,,,60100.0,"['AI Marketing tools', 'AI in business']",2023.0,Jul 24 - Jul 30,12/08/2023
Data Idols Summer School competition - share a post on LinkedIn about Data Idols Summer School for a chance to win prizes.,['https://datasciencefestival.com/di-summerschool-competition-2023/?mc_cid=73f7bdb535&mc_eid=UNIQID'],30,24/07/2023,24/07/2023,,189880207f6d7673,['https://datasciencefestival.com/di-summerschool-competition-2023/?mc_cid=73f7bdb535&mc_eid=UNIQID'],,,,,,,,2023.0,Jul 24 - Jul 30,13/08/2023
Generative AI Sparks Investment Frenzy. The emergence of generative AI is shifting the investment landscape.,"['Generative AI Sparks Investment Frenzy - Link 1', 'Generative AI Sparks Investment Frenzy - Link 2']",29,17/07/2023,17/07/2023,,18979e89ee3ae250,"['Generative AI Sparks Investment Frenzy - Link 1', 'Generative AI Sparks Investment Frenzy - Link 2']",432.0,43400000.0,16000.0,,,1200.0,,2023.0,Jul 17 - Jul 23,12/08/2023
"AI is being used to communicate with various animal species, helping to understand their complex communication methods.",['https://www.scientificamerican.com/article/how-scientists-are-using-ai-to-talk-to-animals/'],29,17/07/2023,17/07/2023,,18978ab9a7715f19,['https://www.scientificamerican.com/article/how-scientists-are-using-ai-to-talk-to-animals/'],10000.0,38600000.0,416.0,,,1520.0,,2023.0,Jul 17 - Jul 23,12/08/2023
"Explore content from KDnuggets partners on DataOps, synthetic data, neural networks and deep learning, and data storytelling.","['https://www.kdnuggets.com/2023/07/dataopslive-unlock-dataops-success-featured-gartner-market-guide.html', 'https://www.kdnuggets.com/2023/07/mostly-data-access-severely-lacking-synthetic-data-help.html', 'https://www.kdnuggets.com/2023/07/aggarwal-neural-networks-deep-learning-textbook-2nd-edition.html', 'https://www.kdnuggets.com/2023/07/manning-data-storytelling-the-art-telling-stories-data.html']",29,17/07/2023,17/07/2023,,1896f5a53ea7542d,"['https://www.kdnuggets.com/2023/07/dataopslive-unlock-dataops-success-featured-gartner-market-guide.html', 'https://www.kdnuggets.com/2023/07/mostly-data-access-severely-lacking-synthetic-data-help.html', 'https://www.kdnuggets.com/2023/07/aggarwal-neural-networks-deep-learning-textbook-2nd-edition.html', 'https://www.kdnuggets.com/2023/07/manning-data-storytelling-the-art-telling-stories-data.html']",850.0,1340000.0,305.0,,,52100.0,,2023.0,Jul 17 - Jul 23,12/08/2023
"Want to advertise your products in front of thousands of AI investors, developers, and enthusiasts?",['https://docs.google.com/forms/d/e/1FAIpQLSc-UF-frqUxlWSCxYgjV0KMgciuq3zrLNJuiE8bBPT7r6vF5A/viewform'],29,17/07/2023,17/07/2023,,1897db290e814d0c,['https://docs.google.com/forms/d/e/1FAIpQLSc-UF-frqUxlWSCxYgjV0KMgciuq3zrLNJuiE8bBPT7r6vF5A/viewform'],9.0,3000000000.0,4310.0,,,8.0,,2023.0,Jul 17 - Jul 23,12/08/2023
"The Rundown recommends new AI tools including RunDiffusion, FixMeBot, PDF to Chatbot, workstreams.ai, MindStudio, Lyzr.ai, and Supertools.","['https://rundiffusion.com/', 'https://fixmebot.com/', 'https://pdftochatbot.thesamur.ai/', 'https://www.workstreams.ai/', 'https://youai.ai/mindstudio', 'https://www.lyzr.ai/', 'https://supertools.therundown.ai/']",30,24/07/2023,24/07/2023,The Rundown AI <therundownai@mail.beehiiv.com>,1898d423d9eecffd,"['https://rundiffusion.com/', 'https://fixmebot.com/', 'https://pdftochatbot.thesamur.ai/', 'https://www.workstreams.ai/', 'https://youai.ai/mindstudio', 'https://www.lyzr.ai/', 'https://supertools.therundown.ai/']",93.0,101.0,5.0,,,396000.0,['New Tech and AI tools'],2023.0,Jul 24 - Jul 30,12/08/2023
"Learn more about KDnuggets, its privacy policy, and contact information.","['https://www.kdnuggets.com/about/index.html', 'https://www.kdnuggets.com/news/privacy-policy.html', 'https://www.kdnuggets.com/contact.html']",29,17/07/2023,17/07/2023,,1896f5a53ea7542d,"['https://www.kdnuggets.com/about/index.html', 'https://www.kdnuggets.com/news/privacy-policy.html', 'https://www.kdnuggets.com/contact.html']",,,,,,,,2023.0,Jul 17 - Jul 23,12/08/2023
AI as an inventor - Can AI invent new things?,"['AI Inventorship Listening Sessions', 'Artificial Inventor Project']",29,17/07/2023,17/07/2023,,1896a76c1c2fdc4c,"['AI Inventorship Listening Sessions', 'Artificial Inventor Project']",,,,,,,,2023.0,Jul 17 - Jul 23,12/08/2023
Learn more about the Mailchimp email marketing platform.,['http://www.mailchimp.com/email-referral/?utm_source=freemium_newsletter&utm_medium=email&utm_campaign=referral_marketing&aid=73c2f0478f1b3cd8343ae8f45&afl=1'],29,17/07/2023,17/07/2023,,1897921feed5731d,['http://www.mailchimp.com/email-referral/?utm_source=freemium_newsletter&utm_medium=email&utm_campaign=referral_marketing&aid=73c2f0478f1b3cd8343ae8f45&afl=1'],,,,,,,,2023.0,Jul 17 - Jul 23,13/08/2023
"AI Quality: How to Test and Debug ML Models is a hands-on course for practitioners, taught by experts from leading universities. Sign up today and start the course whenever you like.",['https://go.truera.com/ai-quality-workshop-20230807k?utm_campaign=workshop-aiq-test-debug&utm_source=kdnuggets&utm_medium=media'],32,07/08/2023,07/08/2023,KDnuggets <editor1@kdnuggets.com>,189d05347f57ea93,['https://go.truera.com/ai-quality-workshop-20230807k?utm_campaign=workshop-aiq-test-debug&utm_source=kdnuggets&utm_medium=media'],,,,,,,"['Making money with AI', 'New Tech and AI tools']",2023.0,Aug 07 - Aug 13,12/08/2023
"Introducing the Toolbar, picture-in-picture for Google Meet, and a very special thank you from the team.","['http://www.mailchimp.com/email-referral/?utm_source=freemium_newsletter&utm_medium=email&utm_campaign=referral_marketing&aid=73c2f0478f1b3cd8343ae8f45&afl=1', 'https://resources.arc.net/en/articles/8146376-can-i-show-my-url-extensions-at-all-times', 'https://resources.arc.net/en/articles/6586103-mini-player-watch-or-listen-as-you-browse', 'https://www.folklore.org/StoryView.py?story=Signing_Party.txt', 'https://browserco.typeform.com/thecredits', 'https://arc.net/e/D25B2EEA-7506-4850-A169-3B2A00802889', 'https://thebrowser.company/', 'https://twitter.com/codeblue87', 'https://twitter.com/pter', 'https://twitter.com/vivekgalatage/status/1679509612486094856', 'https://company.us6.list-manage.com/unsubscribe?u=73c2f0478f1b3cd8343ae8f45&id=3de31cbb2f&e=2839c689a3&c=833c514b49']",29,17/07/2023,17/07/2023,,1897921feed5731d,"['http://www.mailchimp.com/email-referral/?utm_source=freemium_newsletter&utm_medium=email&utm_campaign=referral_marketing&aid=73c2f0478f1b3cd8343ae8f45&afl=1', 'https://resources.arc.net/en/articles/8146376-can-i-show-my-url-extensions-at-all-times', 'https://resources.arc.net/en/articles/6586103-mini-player-watch-or-listen-as-you-browse', 'https://www.folklore.org/StoryView.py?story=Signing_Party.txt', 'https://browserco.typeform.com/thecredits', 'https://arc.net/e/D25B2EEA-7506-4850-A169-3B2A00802889', 'https://thebrowser.company/', 'https://twitter.com/codeblue87', 'https://twitter.com/pter', 'https://twitter.com/vivekgalatage/status/1679509612486094856', 'https://company.us6.list-manage.com/unsubscribe?u=73c2f0478f1b3cd8343ae8f45&id=3de31cbb2f&e=2839c689a3&c=833c514b49']",,,,,,,,2023.0,Jul 17 - Jul 23,13/08/2023
Unlocking the promise of generative AI with your enterprise data: Prophecy Generative AI + Data Copilot are here.,"['https://landing.prophecy.io/unlocking-the-promise-of-generative-ai-with-your-enterprise-data?utm_campaign=live-webinar-Unlocking-the-promise-of-generative-AI-with-your-enterprise-data&utm_medium=paid-media&utm_source=kd-nuggets', 'https://app.prophecy.io/metadata/auth/signup?utm_campaign=live-webinar-Unlocking-the-promise-of-generative-AI-with-your-enterprise-data&utm_medium=paid-media&utm_source=kd-nuggets']",29,17/07/2023,17/07/2023,,1896e808c897dab3,"['https://landing.prophecy.io/unlocking-the-promise-of-generative-ai-with-your-enterprise-data?utm_campaign=live-webinar-Unlocking-the-promise-of-generative-AI-with-your-enterprise-data&utm_medium=paid-media&utm_source=kd-nuggets', 'https://app.prophecy.io/metadata/auth/signup?utm_campaign=live-webinar-Unlocking-the-promise-of-generative-AI-with-your-enterprise-data&utm_medium=paid-media&utm_source=kd-nuggets']",56.0,,,,,,,2023.0,Jul 17 - Jul 23,13/08/2023
"Learn about Unleashing WisePizza, a game-changing data exploration library.",['https://datasciencefestival.com/session/unleashing-wisepizza-finding-unusual-segments-in-your-data/?mc_cid=764752b4b1&mc_eid=UNIQID'],32,07/08/2023,07/08/2023,Data Science Festival <info@datasciencefestival.com>,189d01ab6563fd04,['https://datasciencefestival.com/session/unleashing-wisepizza-finding-unusual-segments-in-your-data/?mc_cid=764752b4b1&mc_eid=UNIQID'],,,,,,,['AI real-world applications'],2023.0,Aug 07 - Aug 13,12/08/2023
Become a Low-Code AI Ninja,['https://go.howarddc.com/low-code-prompts'],29,17/07/2023,17/07/2023,,1896e4e68e598a45,['https://go.howarddc.com/low-code-prompts'],,,,,,,,2023.0,Jul 17 - Jul 23,12/08/2023
Google's AI Search is evolving and now includes images and videos in the summary box at the top of search results. CEO Sundar Pichai sees it as the future of Google Search.,['https://www.theverge.com/2023/8/2/23817107/google-ai-search-generative-experience-videos-links'],32,07/08/2023,07/08/2023,neonpulse <neonpulse@mail.beehiiv.com>,189d018c5496495e,['https://www.theverge.com/2023/8/2/23817107/google-ai-search-generative-experience-videos-links'],,,,,,,"['AI real-world applications', 'AI news']",2023.0,Aug 07 - Aug 13,12/08/2023
Super Data Science podcast. A podcast episode discussing generative AI and its potential in music.,"['Super Data Science podcast - Link 1', 'Super Data Science podcast - Link 2']",29,17/07/2023,17/07/2023,,18979e89ee3ae250,"['Super Data Science podcast - Link 1', 'Super Data Science podcast - Link 2']",,,,,,,,2023.0,Jul 17 - Jul 23,12/08/2023
Police in New York used an AI-driven platform called Rekor to catch a drug trafficker named David Zayas.,['https://gizmodo.com/rekor-ai-system-analyzes-driving-patterns-criminals-1850647270'],29,17/07/2023,17/07/2023,,18978ab9a7715f19,['https://gizmodo.com/rekor-ai-system-analyzes-driving-patterns-criminals-1850647270'],,,,,,,,2023.0,Jul 17 - Jul 23,12/08/2023
"Apple and Amazon are going 'all-in' on AI, with Tim Cook stating that Apple is incorporating AI into every product and Amazon revealing that every team is now working on AI.","['Apple and Amazon go ‘all-in’ on AI', 'https://www.independent.co.uk/tech/apple-ai-artificial-intelligence-tim-cook-iphone-b2387879.html?ref=futuretools.io']",32,07/08/2023,07/08/2023,The Rundown AI <therundownai@mail.beehiiv.com>,189d034f612b8d48,"['Apple and Amazon go ‘all-in’ on AI', 'https://www.independent.co.uk/tech/apple-ai-artificial-intelligence-tim-cook-iphone-b2387879.html?ref=futuretools.io']",,,,,,,"['AI in business', 'Making money with AI']",2023.0,Aug 07 - Aug 13,12/08/2023
"Hunna Technology has introduced IndigoVX, the first AI CEO in Europe, combining AI with human intelligence to make optimal business decisions.",['https://www.asiaone.com/business/first-ai-ceo-europe-revolutionizes-leadership-using-human-supervision-safety'],30,24/07/2023,24/07/2023,The Rundown AI <therundownai@mail.beehiiv.com>,1898d423d9eecffd,['https://www.asiaone.com/business/first-ai-ceo-europe-revolutionizes-leadership-using-human-supervision-safety'],,,,,,,['AI in business'],2023.0,Jul 24 - Jul 30,12/08/2023
"Update on Morningside Automation, a monthly automation service that helps businesses identify AI implementation opportunities on a retainer basis. Details about the service operation and workflow.",['https://www.morningsideautomation.com/'],29,17/07/2023,17/07/2023,,18983dcb5e5a4b1e,['https://www.morningsideautomation.com/'],,,,,,,,2023.0,Jul 17 - Jul 23,13/08/2023
Exploring additional products that can be attached to AI automation offers to increase value. Example of creating a 'chat analytics dashboard' for AI persona chatbots.,['https://www.loom.com/share/9cfafee9c47d42df9deb907f30835e02'],29,17/07/2023,17/07/2023,,18983dcb5e5a4b1e,['https://www.loom.com/share/9cfafee9c47d42df9deb907f30835e02'],392000.0,,,,,,,2023.0,Jul 17 - Jul 23,13/08/2023
