Topic summary,Associated Links,Week Number,wc_date,Date,Sender,Email ID,link,L,LD,I,whois,source,Rank,Category,Year,Week Range,date_updated
"Belva enables an AI agent to take phone calls, MailerLite AI enhances email design and delivery, Zefi integrates applications, QRCode AI creates beautiful QR codes, YouTube transcripts by Editby.ai download and edit YouTube videos, and Supertools organizes 100's of AI tools.","['https://www.belva.ai/', 'https://www.mailerlite.com/', 'https://www.zefi.ai/', 'https://qrcode-ai.com/', 'https://www.transcriptdownload.com/', 'https://supertools.therundown.ai/']",29,17/07/2023,17/07/2023,,18978ab9a7715f19,"['https://www.belva.ai/', 'https://www.mailerlite.com/', 'https://www.zefi.ai/', 'https://qrcode-ai.com/', 'https://www.transcriptdownload.com/', 'https://supertools.therundown.ai/']",,,,,,,,2023.0,Jul 17 - Jul 23,12/08/2023
Sponsorship opportunity to reach over 200k+ AI enthusiasts with your product.,['https://sponsor.therundown.ai/'],29,17/07/2023,17/07/2023,,18978ab9a7715f19,['https://sponsor.therundown.ai/'],,,,,,,,2023.0,Jul 17 - Jul 23,12/08/2023
OpenAI partners with the American Journalism Project to support local news organizations. OpenAI is committing $5 million and API credits to the project. The partnership aims to enhance the analysis of public data and counter misinformation.,['https://openai.com/blog/partnership-with-american-journalism-project-to-support-local-news'],29,17/07/2023,17/07/2023,,1896e5e12af21261,['https://openai.com/blog/partnership-with-american-journalism-project-to-support-local-news'],,,,,,,,2023.0,Jul 17 - Jul 23,13/08/2023
Pre-Order: ChatGPT For Android,['[Tweet:]'],29,17/07/2023,17/07/2023,,18982ee974e2b76b,['[Tweet:]'],,,,,,,,2023.0,Jul 17 - Jul 23,12/08/2023
Machine Learning Bootcamp,['https://tdwi.org/events/conferences/orlando/information/ml-bootcamp.aspx?utm_source=KD&utm_medium=email&utm_campaign=OR23-072023'],29,17/07/2023,17/07/2023,,18973ae1fbcc8689,['https://tdwi.org/events/conferences/orlando/information/ml-bootcamp.aspx?utm_source=KD&utm_medium=email&utm_campaign=OR23-072023'],,,,,,,,2023.0,Jul 17 - Jul 23,13/08/2023
Inside The Toolkit: Type. Type is an AI-first document editor that offers a great editing experience and is used by over 25k business owners and creators.,['[link]'],29,17/07/2023,17/07/2023,,18982ee974e2b76b,['[link]'],,,,,,,,2023.0,Jul 17 - Jul 23,12/08/2023
Offering an exclusive 20% early bird discount for the ebook 'Maximizing Productivity with ChatGPT'.,['Maximizing Productivity with ChatGPT (https://machinelearningmastery.com/productivity-with-chatgpt/)'],30,24/07/2023,24/07/2023,KDnuggets <editor1@kdnuggets.com>,1898ddc66b483a1b,['Maximizing Productivity with ChatGPT (https://machinelearningmastery.com/productivity-with-chatgpt/)'],,,,,,,['AI Marketing tools'],2023.0,Jul 24 - Jul 30,13/08/2023
"Contact details for The Browser Company in New York. Also, find the unsubscribe link for email notifications.","['https://thebrowser.company/', 'https://company.us6.list-manage.com/unsubscribe?u=73c2f0478f1b3cd8343ae8f45&id=3de31cbb2f&e=2839c689a3&c=b8aeec1250']",30,24/07/2023,24/07/2023,The Browser Company <members@arc.net>,1898d714320dfd5a,"['https://thebrowser.company/', 'https://company.us6.list-manage.com/unsubscribe?u=73c2f0478f1b3cd8343ae8f45&id=3de31cbb2f&e=2839c689a3&c=b8aeec1250']",,,,,,,['AI Marketing tools'],2023.0,Jul 24 - Jul 30,12/08/2023
"OpenAI's AI detection tool AI Classifier has been discontinued due to low accuracy, and the company is exploring more effective methods to detect AI-generated content.",['https://decrypt.co/149826/openai-quietly-shutters-its-ai-detection-tool'],30,24/07/2023,24/07/2023,The Rundown AI <therundownai@mail.beehiiv.com>,1898d423d9eecffd,['https://decrypt.co/149826/openai-quietly-shutters-its-ai-detection-tool'],,,,,,,['AI news'],2023.0,Jul 24 - Jul 30,12/08/2023
Here's a great overview of nine popular options for Python vector databases.,['https://code.dblock.org/2023/06/16/getting-started-with-vector-dbs-in-python.html?utm_campaign=Data_Elixir&utm_source=Data_Elixir_445'],30,24/07/2023,24/07/2023,Data Elixir <lon@dataelixir.com>,1898ec496527701f,['https://code.dblock.org/2023/06/16/getting-started-with-vector-dbs-in-python.html?utm_campaign=Data_Elixir&utm_source=Data_Elixir_445'],,,,,,,['New Tech and AI tools'],2023.0,Jul 24 - Jul 30,12/08/2023
Participate in the Data Idols Summer School competition and win exciting prizes!,['https://datasciencefestival.com/di-summerschool-competition-2023/?mc_cid=764752b4b1&mc_eid=UNIQID'],32,07/08/2023,07/08/2023,Data Science Festival <info@datasciencefestival.com>,189d01ab6563fd04,['https://datasciencefestival.com/di-summerschool-competition-2023/?mc_cid=764752b4b1&mc_eid=UNIQID'],,,,,,,"['AI news', 'AI Marketing tools']",2023.0,Aug 07 - Aug 13,12/08/2023
"IBM is offering free AI courses for developers to learn AI skills, generative AI, and popular open-source tools.","['IBM offers free AI courses for developers', 'https://fagenwasanni.com/news/ibm-offers-free-ai-courses-for-developers/114708/']",32,07/08/2023,07/08/2023,The Rundown AI <therundownai@mail.beehiiv.com>,189d034f612b8d48,"['IBM offers free AI courses for developers', 'https://fagenwasanni.com/news/ibm-offers-free-ai-courses-for-developers/114708/']",,,,,,,['AI real-world applications'],2023.0,Aug 07 - Aug 13,12/08/2023
How to add Notion AI to your free Notion plan and explore medium to advanced use cases.,"['https://ntn.so/promptsdaily', 'https://media.beehiiv.com/cdn-cgi/image/fit=scale-down,format=auto,onerror=redirect,quality=80/uploads/asset/file/b992cec6-c891-4b28-83f9-c767f2f12fd8/CleanShot_2023-07-18_at_22.26.03_2x.png']",29,17/07/2023,17/07/2023,,18978991f533b255,"['https://ntn.so/promptsdaily', 'https://media.beehiiv.com/cdn-cgi/image/fit=scale-down,format=auto,onerror=redirect,quality=80/uploads/asset/file/b992cec6-c891-4b28-83f9-c767f2f12fd8/CleanShot_2023-07-18_at_22.26.03_2x.png']",,,,,,,,2023.0,Jul 17 - Jul 23,12/08/2023
Hollywood is grappling with the dilemma of whether audiences would pay to see a deep fake Tom Cruise on the big screen due to advancements in AI technology. The film industry is facing disruption and writers and actors are demanding fair treatment and compensation in the age of AI.,"['Tom Cruise', 'writers and actors strike', 'use of AI', 'AI capabilities', 'Matthew Belloni', 'Jaron Lanier', 'Sarah Silverman', 'class-action lawsuits against OpenAI and Meta', 'fair treatment of creators with AI']",29,17/07/2023,17/07/2023,,189788c69e540129,"['Tom Cruise', 'writers and actors strike', 'use of AI', 'AI capabilities', 'Matthew Belloni', 'Jaron Lanier', 'Sarah Silverman', 'class-action lawsuits against OpenAI and Meta', 'fair treatment of creators with AI']",,,,,,,,2023.0,Jul 17 - Jul 23,12/08/2023
Cool AI Tools,"['https://superhuman.com/', 'https://www.sidekic.ai/intro', 'https://suneai.com/']",29,17/07/2023,17/07/2023,,1897365c162b2394,"['https://superhuman.com/', 'https://www.sidekic.ai/intro', 'https://suneai.com/']",,,,,,,,2023.0,Jul 17 - Jul 23,12/08/2023
"AI Improves Employee Productivity by 66%. The usability of AI platforms like ChatGPT for real business tasks has finally been quantified, and the results are impressive.","['https://www.nngroup.com/articles/ai-productivity-customer-support/', 'https://www.nngroup.com/articles/chatgpt-productivity/', 'https://www.nngroup.com/articles/ai-programmers-productive/']",29,17/07/2023,17/07/2023,,1897db290e814d0c,"['https://www.nngroup.com/articles/ai-productivity-customer-support/', 'https://www.nngroup.com/articles/chatgpt-productivity/', 'https://www.nngroup.com/articles/ai-programmers-productive/']",,,,,,,,2023.0,Jul 17 - Jul 23,12/08/2023
RudderStack Profiles takes the SQL grunt work out of building customer profiles.,['https://www.rudderstack.com/product/profiles/?utm_source=data_elixir&utm_medium=newsletter&utm_campaign=CMPGN_173_P&utm_content=None&utm_term=%7Bkeyword%7D&utm_referrer=None&raid=ff47ca3fcd9b466cb67ba56fe54e2d34'],30,24/07/2023,24/07/2023,Data Elixir <lon@dataelixir.com>,1898ec496527701f,['https://www.rudderstack.com/product/profiles/?utm_source=data_elixir&utm_medium=newsletter&utm_campaign=CMPGN_173_P&utm_content=None&utm_term=%7Bkeyword%7D&utm_referrer=None&raid=ff47ca3fcd9b466cb67ba56fe54e2d34'],,,,,,,['AI Marketing tools'],2023.0,Jul 24 - Jul 30,12/08/2023
This email was sent to rypoll@gmail.com,['mailto:rypoll@gmail.com'],29,17/07/2023,17/07/2023,,1896e808c897dab3,['mailto:rypoll@gmail.com'],,,,,,,,2023.0,Jul 17 - Jul 23,13/08/2023
Business Growth With AI (Made Simple),['Business Growth With AI (Made Simple)'],29,17/07/2023,17/07/2023,,1896e3f1ef27617c,['Business Growth With AI (Made Simple)'],,,,,,,,2023.0,Jul 17 - Jul 23,12/08/2023
OpenAI has doubled GPT-4's message cap for Plus users to 50. Google has introduced the 'Genesis' AI tool to help journalists write news.,"['https://www.searchenginejournal.com/openai-increases-gpt-4-message-cap-for-chatgpt/492131/#close', 'https://9to5google.com/2023/07/19/google-news-ai-genesis/']",29,17/07/2023,17/07/2023,,1897dc9552c7614a,"['https://www.searchenginejournal.com/openai-increases-gpt-4-message-cap-for-chatgpt/492131/#close', 'https://9to5google.com/2023/07/19/google-news-ai-genesis/']",306.0,,,,,,,2023.0,Jul 17 - Jul 23,13/08/2023
Key Considerations for Fine-Tuning an LLM Model. Factors to consider before fine-tuning a pre-trained Large Language Model.,"['Key Considerations for Fine-Tuning an LLM Model - Link 1', 'Key Considerations for Fine-Tuning an LLM Model - Link 2']",29,17/07/2023,17/07/2023,,18979e89ee3ae250,"['Key Considerations for Fine-Tuning an LLM Model - Link 1', 'Key Considerations for Fine-Tuning an LLM Model - Link 2']",,,,,,,,2023.0,Jul 17 - Jul 23,12/08/2023
How to Get Smarter Every Day,['How to Get Smarter Every Day'],30,24/07/2023,24/07/2023,,18987aaf47bba3c2,['How to Get Smarter Every Day'],2570.0,,,,,,,2023.0,Jul 24 - Jul 30,13/08/2023
A moment of zen with a Modern Mona Lisa image.,['Modern Mona Lisa'],29,17/07/2023,17/07/2023,,189788c69e540129,['Modern Mona Lisa'],,,,,,,,2023.0,Jul 17 - Jul 23,12/08/2023
"Featured AI product - Intelogos, an employee wellbeing and AI performance management software. Other AI tools include FixMeBot, n8n 1.0, PDF to Chatbot, and Superhuman.","['https://www.intelogos.com/?utm_source=bigbraindaily.com&utm_medium=newsletter&utm_campaign=UnclassifiedAd', 'https://fixmebot.com/', 'https://n8n.io/', 'https://pdftochatbot.thesamur.ai/', 'https://superhuman.com/']",30,24/07/2023,24/07/2023,Big Brain <bigbrain@mail.beehiiv.com>,1898d297871e1b34,"['https://www.intelogos.com/?utm_source=bigbraindaily.com&utm_medium=newsletter&utm_campaign=UnclassifiedAd', 'https://fixmebot.com/', 'https://n8n.io/', 'https://pdftochatbot.thesamur.ai/', 'https://superhuman.com/']",73900.0,,,,,,"['AI Marketing tools', 'New Tech and AI tools']",2023.0,Jul 24 - Jul 30,13/08/2023
"How AI could perpetuate racism, sexism and other biases in society",['https://www.npr.org/2023/07/19/1188739764/how-ai-could-perpetuate-racism-sexism-and-other-biases-in-society'],29,17/07/2023,17/07/2023,,189736651f2f87ac,['https://www.npr.org/2023/07/19/1188739764/how-ai-could-perpetuate-racism-sexism-and-other-biases-in-society'],,,,,,,,2023.0,Jul 17 - Jul 23,12/08/2023
Test-Driven Data Analysis (TDDA) is an approach to quality for data and for data analysis pipelines.,['https://codeforthought.buzzsprout.com/1326658/13192819-en-test-driven-data-analysis-with-nick-radcliffe?utm_campaign=Data_Elixir&utm_source=Data_Elixir_445'],30,24/07/2023,24/07/2023,Data Elixir <lon@dataelixir.com>,1898ec496527701f,['https://codeforthought.buzzsprout.com/1326658/13192819-en-test-driven-data-analysis-with-nick-radcliffe?utm_campaign=Data_Elixir&utm_source=Data_Elixir_445'],,,,,,,['AI real-world applications'],2023.0,Jul 24 - Jul 30,12/08/2023
"That’s all for today folks! If you’re enjoying neonpulse, we would really appreciate it if you would consider sharing our newsletter with a friend by sending them this link:",['https://www.neonpulse.ai/subscribe'],29,17/07/2023,17/07/2023,,1897db290e814d0c,['https://www.neonpulse.ai/subscribe'],,,,,,,,2023.0,Jul 17 - Jul 23,12/08/2023
Big Brain is shifting to an AI careers-focused platform and changing its content schedule to three days a week. They are also launching a premium tier for subscribers.,"['https://www.bigbraindaily.com/upgrade', 'https://www.bigbraindaily.com/upgrade?offer_id=927dbe92-efd3-4d94-bea4-89bbe878d53c']",32,07/08/2023,07/08/2023,Big Brain <bigbrain@mail.beehiiv.com>,189d1e0edefbed6d,"['https://www.bigbraindaily.com/upgrade', 'https://www.bigbraindaily.com/upgrade?offer_id=927dbe92-efd3-4d94-bea4-89bbe878d53c']",,,,,,,"['Making money with AI', 'AI Marketing tools', 'AI in business']",2023.0,Aug 07 - Aug 13,12/08/2023
"A cookbook for common tasks and problems in polars, R base, dplyr, tidyr, and data.table.",['https://ddotta.github.io/cookbook-rpolars/?utm_campaign=Data_Elixir&utm_source=Data_Elixir_445'],30,24/07/2023,24/07/2023,Data Elixir <lon@dataelixir.com>,1898ec496527701f,['https://ddotta.github.io/cookbook-rpolars/?utm_campaign=Data_Elixir&utm_source=Data_Elixir_445'],,,,,,,['No code AI use cases'],2023.0,Jul 24 - Jul 30,12/08/2023
Elon Bought “AI.com”: Elon Musk acquired the domain name AI.com from OpenAI.,['Elon Musk took AI.com from OpenAI (link)'],31,31/07/2023,06/08/2023,Prompts Daily <aadit@mail.neatprompts.com>,189cb1f4030f7c91,['Elon Musk took AI.com from OpenAI (link)'],,,,,,,"['AI news', 'New Tech and AI tools']",2023.0,Jul 31 - Aug 06,13/08/2023
Ensure your career doesn't get disrupted in the future by attending the exclusive FREE Live Training sessions.,['https://superdatascience.ontraport.com/u/MTM1MjMyLzAvMzA3MTQ1LzAvMTI4OS8wLzFiYmFkMjI4ZmM3MDZhMTYwYjFlZGM3YjE5NWQ0MTcxLzczMDA1NTMy'],32,07/08/2023,07/08/2023,SuperDataScience Team <support@superdatascience.com>,189d0fff55f06ae4,['https://superdatascience.ontraport.com/u/MTM1MjMyLzAvMzA3MTQ1LzAvMTI4OS8wLzFiYmFkMjI4ZmM3MDZhMTYwYjFlZGM3YjE5NWQ0MTcxLzczMDA1NTMy'],,,,,,,['AI Marketing tools'],2023.0,Aug 07 - Aug 13,13/08/2023
"Use case 3: Creating concise guides for teams in Notion, including action item lists.","['https://ntn.so/promptsdaily', 'https://media.beehiiv.com/cdn-cgi/image/fit=scale-down,format=auto,onerror=redirect,quality=80/uploads/asset/file/94f25d58-82c5-4c8f-aa88-ba2fcaaf364e/CleanShot_2023-07-18_at_22.57.04_2x.png', 'https://media.beehiiv.com/cdn-cgi/image/fit=scale-down,format=auto,onerror=redirect,quality=80/uploads/asset/file/51ffbbb6-b3e2-42c8-8c31-7f764efc9676/CleanShot_2023-07-18_at_22.58.39_2x.png']",29,17/07/2023,17/07/2023,,18978991f533b255,"['https://ntn.so/promptsdaily', 'https://media.beehiiv.com/cdn-cgi/image/fit=scale-down,format=auto,onerror=redirect,quality=80/uploads/asset/file/94f25d58-82c5-4c8f-aa88-ba2fcaaf364e/CleanShot_2023-07-18_at_22.57.04_2x.png', 'https://media.beehiiv.com/cdn-cgi/image/fit=scale-down,format=auto,onerror=redirect,quality=80/uploads/asset/file/51ffbbb6-b3e2-42c8-8c31-7f764efc9676/CleanShot_2023-07-18_at_22.58.39_2x.png']",,,,,,,,2023.0,Jul 17 - Jul 23,12/08/2023
AECOM (UK): Data Engineer,['https://jobs.smartrecruiters.com/AECOM2/743999918994198-data-engineer'],29,17/07/2023,17/07/2023,,1896e4e68e598a45,['https://jobs.smartrecruiters.com/AECOM2/743999918994198-data-engineer'],,,,,,,,2023.0,Jul 17 - Jul 23,12/08/2023
How Are TDWI Events Different?,['https://tdwi.org/events/conferences/orlando/information/why-tdwi.aspx?utm_source=KD&utm_medium=email&utm_campaign=OR23-072023'],29,17/07/2023,17/07/2023,,18973ae1fbcc8689,['https://tdwi.org/events/conferences/orlando/information/why-tdwi.aspx?utm_source=KD&utm_medium=email&utm_campaign=OR23-072023'],,,,,,,,2023.0,Jul 17 - Jul 23,13/08/2023
Looking for career mentorship and job hunting resources,"['Pathrise mentorship opportunity', '20% discount for Taro career development', ""Manning Publications discount code 'podkens21'"", 'Interview Query for interview preparation']",30,24/07/2023,24/07/2023,,18987aaf47bba3c2,"['Pathrise mentorship opportunity', '20% discount for Taro career development', ""Manning Publications discount code 'podkens21'"", 'Interview Query for interview preparation']",619.0,,,,,,,2023.0,Jul 24 - Jul 30,13/08/2023
Texts From My Ex analyzes your text conversations for relationship insights.,['https://textsfrommyex.com/'],29,17/07/2023,17/07/2023,,1897386a1da68a5f,['https://textsfrommyex.com/'],,,,,,,,2023.0,Jul 17 - Jul 23,12/08/2023
"Save up to $1,322* with promo code TAKETEN through Sept. 15","['https://tdwi.org/events/conferences/orlando.aspx?utm_source=KD&utm_medium=email&utm_campaign=OR23-072023', 'https://na.eventscloud.com/ereg/newreg.php?eventid=724069&discountcode=TAKETEN']",29,17/07/2023,17/07/2023,,18973ae1fbcc8689,"['https://tdwi.org/events/conferences/orlando.aspx?utm_source=KD&utm_medium=email&utm_campaign=OR23-072023', 'https://na.eventscloud.com/ereg/newreg.php?eventid=724069&discountcode=TAKETEN']",0.0,,,,,,,2023.0,Jul 17 - Jul 23,13/08/2023
Funding Raised: ~$12.85M. Ati Motors raises $10.85M and Gushwork.ai raises $2M in funding.,"['[Read more]', '[Read more]']",29,17/07/2023,17/07/2023,,18982ee974e2b76b,"['[Read more]', '[Read more]']",,,,,,,,2023.0,Jul 17 - Jul 23,12/08/2023
"Composer allows you to leverage AI to trade like a Wall Street Titan. This AI tool helps you create algorithmic trading strategies that automatically trade for you, no coding required.",['https://www.composer.trade/?utm_source=therundown&amp;utm_medium=newsletter&amp;utm_campaign=7-24-23'],30,24/07/2023,24/07/2023,,189881bc7fff7897,['https://www.composer.trade/?utm_source=therundown&amp;utm_medium=newsletter&amp;utm_campaign=7-24-23'],,,,,,,,2023.0,Jul 24 - Jul 30,12/08/2023
Check out KDnuggets website.,['https://www.kdnuggets.com/index.html'],29,17/07/2023,17/07/2023,,1896f5a53ea7542d,['https://www.kdnuggets.com/index.html'],,,,,,,,2023.0,Jul 17 - Jul 23,12/08/2023
Accenture is investing $3B in AI to expand their AI capabilities and help their clients with generative AI projects. They are also doubling their team of data and AI experts.,"['https://www.forbes.com/sites/bernardmarr/2023/08/07/generative-ai-in-business-why-accenture-is-investing-3-billion-in-ai/', 'https://newsroom.accenture.com/news/accenture-to-invest-3-billion-in-ai-to-accelerate-clients-reinvention.htm']",32,07/08/2023,07/08/2023,Prompts Daily <aadit@mail.neatprompts.com>,189d02559af9920c,"['https://www.forbes.com/sites/bernardmarr/2023/08/07/generative-ai-in-business-why-accenture-is-investing-3-billion-in-ai/', 'https://newsroom.accenture.com/news/accenture-to-invest-3-billion-in-ai-to-accelerate-clients-reinvention.htm']",,,,,,,"['Making money with AI', 'AI in business']",2023.0,Aug 07 - Aug 13,12/08/2023
OpenAI Restricts GPT-4's Facial Recognition Capabilities. OpenAI has placed restrictions on GPT-4's facial recognition capabilities.,"[""OpenAI Restricts GPT-4's Facial Recognition Capabilities""]",29,17/07/2023,17/07/2023,,18973849912f5326,"[""OpenAI Restricts GPT-4's Facial Recognition Capabilities""]",,,,,,,,2023.0,Jul 17 - Jul 23,12/08/2023
Use case 2: Instantly summarize articles using Notion's web clipper and AI summarizer.,"['https://ntn.so/aadit', 'https://media.beehiiv.com/cdn-cgi/image/fit=scale-down,format=auto,onerror=redirect,quality=80/uploads/asset/file/113cbb03-371c-4488-af52-ecdc90fb2de0/CleanShot_2023-07-18_at_22.38.24_2x__1_.png']",29,17/07/2023,17/07/2023,,18978991f533b255,"['https://ntn.so/aadit', 'https://media.beehiiv.com/cdn-cgi/image/fit=scale-down,format=auto,onerror=redirect,quality=80/uploads/asset/file/113cbb03-371c-4488-af52-ecdc90fb2de0/CleanShot_2023-07-18_at_22.38.24_2x__1_.png']",,,,,,,,2023.0,Jul 17 - Jul 23,12/08/2023
"Superhuman AI launches new features for email, including writing emails in your voice. Ken Smythe predicts that 85% of AI startups will fail within three years. McKinsey partners with Cohere to enhance AI capabilities for its enterprise clients.","['https://blog.superhuman.com/superhuman-ai/', 'https://www.thestreet.com/technology/ai-85-pct-of-startups-will-be-out-of-business-in-3-years-major-investor-says', 'https://www.reuters.com/technology/mckinsey-partners-with-startup-cohere-help-clients-adopt-generative-ai-2023-07-18/']",29,17/07/2023,17/07/2023,,1896e5e12af21261,"['https://blog.superhuman.com/superhuman-ai/', 'https://www.thestreet.com/technology/ai-85-pct-of-startups-will-be-out-of-business-in-3-years-major-investor-says', 'https://www.reuters.com/technology/mckinsey-partners-with-startup-cohere-help-clients-adopt-generative-ai-2023-07-18/']",356.0,,,,,,,2023.0,Jul 17 - Jul 23,13/08/2023
Business Growth With AI (Made Simple),['Business Growth With AI (Made Simple)'],29,17/07/2023,17/07/2023,,1896a76c1c2fdc4c,['Business Growth With AI (Made Simple)'],,,,,,,,2023.0,Jul 17 - Jul 23,12/08/2023
The ChatGPT Code Interpreter is OVERRATED,['The ChatGPT Code Interpreter'],30,24/07/2023,24/07/2023,,18987aaf47bba3c2,['The ChatGPT Code Interpreter'],,,,,,,,2023.0,Jul 24 - Jul 30,13/08/2023
Connect with Data Science Festival on various social media platforms.,"['https://twitter.com/datasciencefest?mc_cid=764752b4b1&mc_eid=UNIQID', 'http://www.datasciencefestival.com?mc_cid=764752b4b1&mc_eid=UNIQID', 'mailto:info@datasciencefestival.com', 'https://www.linkedin.com/company/data-science-festival?mc_cid=764752b4b1&mc_eid=UNIQID', 'https://www.youtube.com/channel/UCB02fDSj9GR4rhb1APMNclw?mc_cid=764752b4b1&mc_eid=UNIQID']",32,07/08/2023,07/08/2023,Data Science Festival <info@datasciencefestival.com>,189d01ab6563fd04,"['https://twitter.com/datasciencefest?mc_cid=764752b4b1&mc_eid=UNIQID', 'http://www.datasciencefestival.com?mc_cid=764752b4b1&mc_eid=UNIQID', 'mailto:info@datasciencefestival.com', 'https://www.linkedin.com/company/data-science-festival?mc_cid=764752b4b1&mc_eid=UNIQID', 'https://www.youtube.com/channel/UCB02fDSj9GR4rhb1APMNclw?mc_cid=764752b4b1&mc_eid=UNIQID']",,,,,,,"['AI news', 'AI Marketing tools']",2023.0,Aug 07 - Aug 13,12/08/2023
Hacker AI On Dark Web,['https://www.independent.co.uk/tech/chatgpt-dark-web-wormgpt-hack-b2376627.html'],29,17/07/2023,17/07/2023,,1896e4e68e598a45,['https://www.independent.co.uk/tech/chatgpt-dark-web-wormgpt-hack-b2376627.html'],,,,,,,,2023.0,Jul 17 - Jul 23,12/08/2023
"Advertise your products in front of thousands of AI investors, developers, and enthusiasts",['https://docs.google.com/forms/d/e/1FAIpQLSc-UF-frqUxlWSCxYgjV0KMgciuq3zrLNJuiE8bBPT7r6vF5A/viewform)4'],29,17/07/2023,17/07/2023,,1897365c162b2394,['https://docs.google.com/forms/d/e/1FAIpQLSc-UF-frqUxlWSCxYgjV0KMgciuq3zrLNJuiE8bBPT7r6vF5A/viewform)4'],,,,,,,,2023.0,Jul 17 - Jul 23,12/08/2023
"Microsoft has announced AI for enterprises, integrating Copilot into Microsoft Teams for an additional cost. The announcement caused a surge in Microsoft stocks. The launch date hasn't been specified yet.",['https://blogs.microsoft.com/blog/2023/07/18/furthering-our-ai-ambitions-announcing-bing-chat-enterprise-and-microsoft-365-copilot-pricing/'],29,17/07/2023,17/07/2023,,1896e5e12af21261,['https://blogs.microsoft.com/blog/2023/07/18/furthering-our-ai-ambitions-announcing-bing-chat-enterprise-and-microsoft-365-copilot-pricing/'],,,,,,,,2023.0,Jul 17 - Jul 23,13/08/2023
Australian researchers and startup Cortical Labs received a $600k grant for merging AI and human brain cells. They're developing a lab-grown DishBrain system that mimics 'continual lifelong learning.',['Full Article Here'],30,24/07/2023,24/07/2023,,18987fef57619b96,['Full Article Here'],,,,,,,,2023.0,Jul 24 - Jul 30,12/08/2023
A summary of the email,"['https://link.sbstck.com/redirect/6c461169-d57a-4f0b-b31d-69ebb3819dbd?j=eyJ1IjoiMXNzaXoxIn0.880qsP9Yqd7vIqJZcnmaAWkwye7alu75gumujsCKgpQ', 'https://link.sbstck.com/redirect/b3138672-9a2a-4701-bdfa-afadc3aec328?j=...Certification', 'AI Marketing tools']",32,07/08/2023,07/08/2023,Data Science Weekly Newsletter <datascienceweekly@substack.com>,189d070098f764a1,"['https://link.sbstck.com/redirect/6c461169-d57a-4f0b-b31d-69ebb3819dbd?j=eyJ1IjoiMXNzaXoxIn0.880qsP9Yqd7vIqJZcnmaAWkwye7alu75gumujsCKgpQ', 'https://link.sbstck.com/redirect/b3138672-9a2a-4701-bdfa-afadc3aec328?j=...Certification', 'AI Marketing tools']",427.0,1310000.0,2290.0,,,3560.0,"['AI news', 'New Tech and AI tools']",2023.0,Aug 07 - Aug 13,12/08/2023
Secureframe AI boosts compliance automation and offers various source monitoring and management features.,['https://secureframe.com/request-demo-4?utm_source=partner&utm_medium=newsletter&utm_campaign=0623-beehiivAI'],29,17/07/2023,17/07/2023,,1897386a1da68a5f,['https://secureframe.com/request-demo-4?utm_source=partner&utm_medium=newsletter&utm_campaign=0623-beehiivAI'],,,,,,,,2023.0,Jul 17 - Jul 23,12/08/2023
Information about advertising opportunities on neonpulse.,['https://docs.google.com/forms/d/e/1FAIpQLSc-UF-frqUxlWSCxYgjV0KMgciuq3zrLNJuiE8bBPT7r6vF5A/viewform'],31,31/07/2023,06/08/2023,neonpulse <neonpulse@mail.beehiiv.com>,189caf1319385945,['https://docs.google.com/forms/d/e/1FAIpQLSc-UF-frqUxlWSCxYgjV0KMgciuq3zrLNJuiE8bBPT7r6vF5A/viewform'],,,,,,,['AI Marketing tools'],2023.0,Jul 31 - Aug 06,13/08/2023
Cool AI Tools. Bolty: Have your website roasted by AI. Courseau: Turn your content into mini-courses.,"['https://app.bolty.ai/', 'https://courseau.co/']",29,17/07/2023,17/07/2023,,1897db290e814d0c,"['https://app.bolty.ai/', 'https://courseau.co/']",,,,,,,,2023.0,Jul 17 - Jul 23,12/08/2023
"Meta open-sources LLaMA 2, a powerful language model that outperforms rivals in reasoning and coding. Businesses and researchers can now access AI tools for free.",['Meta is open-sourcing LLaMA 2 (https://about.fb.com/news/2023/07/llama-2/)'],29,17/07/2023,17/07/2023,,1896e437e6681fa1,['Meta is open-sourcing LLaMA 2 (https://about.fb.com/news/2023/07/llama-2/)'],,,,,,,,2023.0,Jul 17 - Jul 23,13/08/2023
